Add,Hotel,Zip,badgetext,extendadd,partial_entry,ratingDate,ratingbubble,review_title,stars2101 North Epcot Resorts Boulevard,Disney's BoardWalk Inn,"Orlando, FL 32830-8442",3,Lake Buena Vista,"Ok to start off, this is by far the best hotel that I have ever stayed at in my entire life. We are a family of four (kids ages 11 and 7) and usually spend a lot of time at MGM and EPCOT so this...","March 10, 2012","ui_bubble_rating bubble_50,ratingDate relativeDate",Cannot Express How Great It Is,4.0 Star Hotel
2101 North Epcot Resorts Boulevard,Disney's BoardWalk Inn,"Orlando, FL 32830-8442",10,Lake Buena Vista,"This was our first Disney experience where we stayed onsite. While I was a little apprehensive about booking a spring break family trip to Disney World, our hotel experience completely erased all apprehension I had! We stayed club level with two small children (under 8)....","March 17, 2012","ui_bubble_rating bubble_40,ratingDate relativeDate",very pleasant disney experience!,4.0 Star Hotel
2101 North Epcot Resorts Boulevard,Disney's BoardWalk Inn,"Orlando, FL 32830-8442",3,Lake Buena Vista,My husband and I just returned from a week long vacation at Disney's Boardwalk Inn with our 3 children. This is our 5th Walt Disney World vacation in 7 years. We have stayed at 3 other deluxe Disney properties and this one was definitely on...,"April 2, 2012","ui_bubble_rating bubble_50,ratingDate relativeDate",Perfect Disney Vacation,4.0 Star Hotel
2101 North Epcot Resorts Boulevard,Disney's BoardWalk Inn,"Orlando, FL 32830-8442",24,Lake Buena Vista,"Normally we stay at Beach Club Resort when we want to be close to Epcot, but decided to try out Boardwalk Inn on a quick 2 day trip to Epcot over Spring Break. The walk is minimally longer to the International Gateway from Boardwalk compared...","April 12, 2012","ui_bubble_rating bubble_50,ratingDate relativeDate",Great ambiance and theming,4.0 Star Hotel
2101 North Epcot Resorts Boulevard,Disney's BoardWalk Inn,"Orlando, FL 32830-8442",10,Lake Buena Vista,This hotel is in a good location. Close to Epcot. You can walk to several other hotels and restaurants. The rooms are very small. I would request a room facing the quiet pool and not the Boardwalk as it can get very loud. Service is...,"January 14, 2012","ui_bubble_rating bubble_30,ratingDate relativeDate",Nice Location,4.0 Star Hotel
2101 North Epcot Resorts Boulevard,Disney's BoardWalk Inn,"Orlando, FL 32830-8442",218,Lake Buena Vista,"This was our second stay, concierge level, at the Boardwalk. We have stayed at many of the Disney Deluxe resorts and usually 'treat' our family to concierge level. The Polynesian Resort is our favorite...so I'll focus here on why we sometimes chose Boardwalk instead.
As...","January 8, 2012","ui_bubble_rating bubble_40,ratingDate relativeDate","Very convenient, friendly concierge staff",4.0 Star Hotel
2101 North Epcot Resorts Boulevard,Disney's BoardWalk Inn,"Orlando, FL 32830-8442",8,Lake Buena Vista,We went to a conference that was located at the Boardwalk Inn fom Jan. 1 to 5th. We received an upgrade and were located on the fourth floor with a water view. We could see the fireworks at Epcot over the lake on our large...,"January 6, 2012","ui_bubble_rating bubble_40,ratingDate relativeDate",Great location but not much better than a Disney moderate,4.0 Star Hotel
2101 North Epcot Resorts Boulevard,Disney's BoardWalk Inn,"Orlando, FL 32830-8442",58,Lake Buena Vista,This is my second stay at the Boardwalk and has quickly become a favorite of mine! We got a large room close to the elevator with a view of Epcot. The room was very clean as was the rest of the resort. While there may...,"January 30, 2012","ui_bubble_rating bubble_40,ratingDate relativeDate",Favorite Disney resort,4.0 Star Hotel
2101 North Epcot Resorts Boulevard,Disney's BoardWalk Inn,"Orlando, FL 32830-8442",3,Lake Buena Vista,"January 2012, My husband and I do not usually spend this kind of money for accomodations; however, we wanted to be in the same hotel as my daughter (who was attending a conference there), and we commented later how glad we were that we had...","January 30, 2012","ui_bubble_rating bubble_50,ratingDate relativeDate",free upgrade to wonderful room,4.0 Star Hotel
2101 North Epcot Resorts Boulevard,Disney's BoardWalk Inn,"Orlando, FL 32830-8442",5,Lake Buena Vista,"I loved thIs resort. It´s very beautiful with many facilities and a very nice pool area. If you intend to go to EPC or HStudios that´s the best place to stay. As I was already prepared for the room level, once at any Disney´s properties...","January 30, 2012","ui_bubble_rating bubble_40,ratingDate relativeDate",Very Good Resort,4.0 Star Hotel
2101 North Epcot Resorts Boulevard,Disney's BoardWalk Inn,"Orlando, FL 32830-8442",33,Lake Buena Vista,"Disney's Boardwalk Inn has a great location for getting the most out of your Disney experience.  It is positioned right next to Epcot and within reasonable walking distance to Hollywood studios, boat service is also available to Hollywood Studios. For those guests with the park...","January 30, 2012","ui_bubble_rating bubble_50,ratingDate relativeDate",Get the most out of your Disney Trip,4.0 Star Hotel
2101 North Epcot Resorts Boulevard,Disney's BoardWalk Inn,"Orlando, FL 32830-8442",8,Lake Buena Vista,"We stayed five nights at the Boardwalk Inn and every moment was a total pleasure. We were given a quiet, third floor room, facing the garden and quiet pool, with a view of the fireworks at Epcot from the balcony. The room was immaculate, with...","February 7, 2012","ui_bubble_rating bubble_50,ratingDate relativeDate","Location, Charm, Peace",4.0 Star Hotel
2101 North Epcot Resorts Boulevard,Disney's BoardWalk Inn,"Orlando, FL 32830-8442",74,Lake Buena Vista,"Having spent five nights at Disney's Animal Kingdom Lodge, we decided to spend our last night at the Boardwalk inn. Although we have visited Disney for many years, this was our first time to stay in a Boardwalk area resort.
We arrived to the front...","February 6, 2012","ui_bubble_rating bubble_50,ratingDate relativeDate",Great location close to Epcot and nice room!,4.0 Star Hotel
2101 North Epcot Resorts Boulevard,Disney's BoardWalk Inn,"Orlando, FL 32830-8442",64,Lake Buena Vista,"We stayed on the Concierge Floor (4th) for 2 nights. My family loved it. Great room, yummy desserts and Cordials. Hotel is centrally located to Epcot and HollyWood Studios. Great nightlife on the Boardwalk. We would Definitely stay again!","February 2, 2012","ui_bubble_rating bubble_50,ratingDate relativeDate",Great time at the Boardwalk,4.0 Star Hotel
2101 North Epcot Resorts Boulevard,Disney's BoardWalk Inn,"Orlando, FL 32830-8442",73,Lake Buena Vista,"We spent 4 great nights on the concierge level in a deluxe room at Disney's Boardwalk Inn in January. We too this trip with my almost 4-year old nephew, and my 18 and 20 year old kids and their 23 year old cousin. I was...","February 1, 2012","ui_bubble_rating bubble_50,ratingDate relativeDate",Disney's Version of the Jersey Shore but so much better...,4.0 Star Hotel
2101 North Epcot Resorts Boulevard,Disney's BoardWalk Inn,"Orlando, FL 32830-8442",5,Lake Buena Vista,"Stayed here over New Years with a group of 32 people. The service of the staff is impeccable and on par with Disney standards. The location of the hotel is great, surrounded by plenty of restaurants, bars, and shops. In addition, the hotel is located...","February 21, 2012","ui_bubble_rating bubble_50,ratingDate relativeDate","Great Service, Location, Club Lounge a Must!",4.0 Star Hotel
2101 North Epcot Resorts Boulevard,Disney's BoardWalk Inn,"Orlando, FL 32830-8442",4,Lake Buena Vista,"Stayed for a week. My wife and I retirees, daughter, son in law and 10 year old grandson.
Great access to Epcot and Studios by boat. Rest of Disney readily available by their transportation system.
Crowds were minimal and except for the turmoil caused by...","February 19, 2012","ui_bubble_rating bubble_50,ratingDate relativeDate",Boardwalk inn. Outstanding ! Employees made the difference.,4.0 Star Hotel
2101 North Epcot Resorts Boulevard,Disney's BoardWalk Inn,"Orlando, FL 32830-8442",96,Lake Buena Vista,We stayed at this hotel and loved it. The decor was beautiful. Room was beautiful. It was a short walk to Epcot. We also walked to the Yacht and Beach Club for some ice cream. The pool here was a lot of fun. It was...,"February 17, 2012","ui_bubble_rating bubble_50,ratingDate relativeDate",Wonderful stay here!,4.0 Star Hotel
2101 North Epcot Resorts Boulevard,Disney's BoardWalk Inn,"Orlando, FL 32830-8442",97,Lake Buena Vista,My son and I stayed at the Boardwalk Inn January 2012 for four nights. This was our first time staying here. We booked a standard view club level room. I requested a boardwalk view (I understood that they have a few of this particular view...,"February 28, 2012","ui_bubble_rating bubble_50,ratingDate relativeDate",Lovely resort in a great location,4.0 Star Hotel
2101 North Epcot Resorts Boulevard,Disney's BoardWalk Inn,"Orlando, FL 32830-8442",54,Lake Buena Vista,"My husband and I stayed at the Boardwalk Inn for a week at the end of our honeymoon. We were very excited to stay here because the inn is walking distance to both Epcot and Hollywood Studios, not to mention several of our favorite restaurants...","February 27, 2012","ui_bubble_rating bubble_40,ratingDate relativeDate",Fantastic location,4.0 Star Hotel
2101 North Epcot Resorts Boulevard,Disney's BoardWalk Inn,"Orlando, FL 32830-8442",15,Lake Buena Vista,"In May my son and his family was planning a vacation to Disney World. My daughter-in-law has a time share, so the place they stay is Boardwalk. This review is mostly for seniors. My husband could not go so I picked up my sister (and...","February 26, 2012","ui_bubble_rating bubble_40,ratingDate relativeDate",Seniors read,4.0 Star Hotel
2101 North Epcot Resorts Boulevard,Disney's BoardWalk Inn,"Orlando, FL 32830-8442",47,Lake Buena Vista,"We stayed here because the in-laws paid for the room. They've stayed in the past and enjoyed it. It was my husband's, mine, and 2 older children's (11 and 16) first time. We stayed on the club level.
When we arrived to our 2 Queen...","March 10, 2012","ui_bubble_rating bubble_50,ratingDate relativeDate",AWESOME service and weekend!,4.0 Star Hotel
2101 North Epcot Resorts Boulevard,Disney's BoardWalk Inn,"Orlando, FL 32830-8442",99,Lake Buena Vista,"This hotel is so charming. Disney is so attentive to the little details and theming is present everywhere you turn.
The BWI really captures the old world charm of waterfront resorts of yesteryear. The whole Boardwalk area is beautful and fun and the bakery ,...","March 3, 2012","ui_bubble_rating bubble_50,ratingDate relativeDate",Club Level - Fabulous Service,4.0 Star Hotel
2101 North Epcot Resorts Boulevard,Disney's BoardWalk Inn,"Orlando, FL 32830-8442",1,Lake Buena Vista,"We just came back from staying at the Boardwalk Inn. Our time there was from February 26th to late afternoon on March 1st. This was our first stay at the Boardwalk Inn and it was a lovely
stay. Our room was spacious, very nice furnishings,...","March 2, 2012","ui_bubble_rating bubble_50,ratingDate relativeDate",Couple Get Away,4.0 Star Hotel
2101 North Epcot Resorts Boulevard,Disney's BoardWalk Inn,"Orlando, FL 32830-8442",33,Lake Buena Vista,We stayed at the Boardwalk Inn August 13 to the 26 2011 for a family vacation to Disneyworld.What a pleasant surprise! We upgraded to water view and it was well worth it. Our room was on the third floor and overlooked the waterway connecting Epcot...,"March 1, 2012","ui_bubble_rating bubble_50,ratingDate relativeDate",Family vacation,4.0 Star Hotel
2101 North Epcot Resorts Boulevard,Disney's BoardWalk Inn,"Orlando, FL 32830-8442",59,Lake Buena Vista,"We weren't sure if the extra money would be worth it IT WAS! As soon as we walked INTO the lobby were greeted by name, taken up to the Inn-Keepers Club, and a private check-in was waiting. Our room was nice, clean, quiet, close to...","March 14, 2012","ui_bubble_rating bubble_50,ratingDate relativeDate",Inn-Keepers Club (aka concierge level) was fabulous!,4.0 Star Hotel
2101 North Epcot Resorts Boulevard,Disney's BoardWalk Inn,"Orlando, FL 32830-8442",43,Lake Buena Vista,"This review is based on traveling with little ones (2 and 4)-family of 4. We booked this hotel based on great reviews, having the beautiful boardwalk, and proximity to epcot and hollywood studios. Unfortunately, we were very underwhelmed and were wishing that we stayed somewhere...","March 14, 2012","ui_bubble_rating bubble_30,ratingDate relativeDate",Good stay with littel ones but not great...,4.0 Star Hotel
2101 North Epcot Resorts Boulevard,Disney's BoardWalk Inn,"Orlando, FL 32830-8442",2,Lake Buena Vista,It was a magical experience. The staff was very friendly and made us feel at home. They were very accommodating. The room was very nice. I liked how the toilet and shower were separate from the vanity sink and mirror. It made it nice when...,"March 12, 2012","ui_bubble_rating bubble_50,ratingDate relativeDate",Great hotel!!,4.0 Star Hotel
2101 North Epcot Resorts Boulevard,Disney's BoardWalk Inn,"Orlando, FL 32830-8442",33,Lake Buena Vista,"We've stayed here 3 times--each time club level. The beds are comfortable and the staff excellent and you can walk to EPCOT and Disney Hollywood Studios. Club level allows access to a lounge with a light breakfast, snacks and drinks during the day, appetizers and...","March 29, 2012","ui_bubble_rating bubble_40,ratingDate relativeDate",Very conveniently located,4.0 Star Hotel
2101 North Epcot Resorts Boulevard,Disney's BoardWalk Inn,"Orlando, FL 32830-8442",14,Lake Buena Vista,"This resort is the closest way to get to the north atlantic boardwalks back when they were in there in there glory days. We stayed in the boardwalk vacation club villas and as usual, counters, furniture and everything was spotless. All of the Disney resorts...","April 10, 2012","ui_bubble_rating bubble_50,ratingDate relativeDate",Welcome to paradise,4.0 Star Hotel
2101 North Epcot Resorts Boulevard,Disney's BoardWalk Inn,"Orlando, FL 32830-8442",31,Lake Buena Vista,"This may be my favorite of all WDW resorts - I've stayed here 3 times, once for my honeymoon, once on a girls weekend, and most recently in December for a family celebration of my parents' 50th anniversary.
First of all, I love Epcot, so...","April 10, 2012","ui_bubble_rating bubble_50,ratingDate relativeDate",Location Location Location!,4.0 Star Hotel
2101 North Epcot Resorts Boulevard,Disney's BoardWalk Inn,"Orlando, FL 32830-8442",58,Lake Buena Vista,A lovely elegant hotel. Our room was very quiet facing onto the gardens. It is probably quite noisy if your room faces the boardwalk or main pool. No restaurant actually 'in' the hotel but several within a minute or two walk. Great position for Epcot....,"April 6, 2012","ui_bubble_rating bubble_50,ratingDate relativeDate",Great location and ambience.,4.0 Star Hotel
2101 North Epcot Resorts Boulevard,Disney's BoardWalk Inn,"Orlando, FL 32830-8442",8,Lake Buena Vista,My husband and I traveled to WDW with my parents...staying in two concierge rooms at the Boardwalk Inn. We are repeat guests at the Boardwalk and find this hotel the ideal location to visit our favorite parks...Epcot/Hollywood Studios. The hotel is easy walking distance to...,"April 4, 2012","ui_bubble_rating bubble_40,ratingDate relativeDate",Great Stay at the Boardwalk Inn,4.0 Star Hotel
2101 North Epcot Resorts Boulevard,Disney's BoardWalk Inn,"Orlando, FL 32830-8442",4,Lake Buena Vista,"We stayed at the Disney Boardwalk Inn for a few days between a Disney Cruise we went on (Disney Dream was fantastic BTW). We stayed in the Inn Keepers Cottages which were part of the concierge level suite. The rooms were nice enough, a loft...","February 13, 2012","ui_bubble_rating bubble_40,ratingDate relativeDate",Disney World Vacation,4.0 Star Hotel
2101 North Epcot Resorts Boulevard,Disney's BoardWalk Inn,"Orlando, FL 32830-8442",38,Lake Buena Vista,"We had a great time at the Boardwalk, which is one of the nicer Disney hotels. There are a few things to be aware of when you stay here: The hotel is very long so request to stay somewhere in the middle of the hotel....","February 24, 2012","ui_bubble_rating bubble_40,ratingDate relativeDate",Nice Disney Hotel - Long hallways,4.0 Star Hotel
2101 North Epcot Resorts Boulevard,Disney's BoardWalk Inn,"Orlando, FL 32830-8442",5,Lake Buena Vista,We stayed in a 1-bedroom villa for the second time in 3 years and we have not been disappointed. I know a lot of reviews have stated that the condition of the rooms are lacking. With the exception of the pullout couch (which probably needs...,"March 10, 2012","ui_bubble_rating bubble_40,ratingDate relativeDate",Perhaps the Disney People Are Listening....,4.0 Star Hotel
2101 North Epcot Resorts Boulevard,Disney's BoardWalk Inn,"Orlando, FL 32830-8442",3,Lake Buena Vista,"We enjoyed our stay at the Boardwalk! We are a family of 5 and appreciated all the drawers and closet space for a hotel room. We stayed 5 nights in late May 2011 and although we never had any special requests, we also never had...","March 20, 2012","ui_bubble_rating bubble_40,ratingDate relativeDate",We'll be back...,4.0 Star Hotel
2101 North Epcot Resorts Boulevard,Disney's BoardWalk Inn,"Orlando, FL 32830-8442",52,Lake Buena Vista,"I had problems already in the arrival: the check in was confused, I had asked a disable twin beds room with tube. It seemed they could not find my reservation made two months before. The employees not friendly at all. I was obliged to pay...","March 20, 2012","ui_bubble_rating bubble_30,ratingDate relativeDate","Very beautiful, but you do not feel the Disney magic",4.0 Star Hotel
2101 North Epcot Resorts Boulevard,Disney's BoardWalk Inn,"Orlando, FL 32830-8442",28,Lake Buena Vista,"As with many Disney resorts, I must say I love this one! The rooms a spacious and clean. The boardwalk area has restaurants, stores and nighttime entertainment! The pool area is gorgeous and all the services here are great.
For dinner, try Cat Cora's restaurant...","March 19, 2012","ui_bubble_rating bubble_50,ratingDate relativeDate","Stayed here, loved it!",4.0 Star Hotel
2101 North Epcot Resorts Boulevard,Disney's BoardWalk Inn,"Orlando, FL 32830-8442",45,Lake Buena Vista,"This hotel benefits from an ideal location right out the back door (International Gateway) of Epcot. The one and only drawback we found was that there is an absolute absence of a food court, either in or on Boardwalk, or at a nearby hotel (YC,...","April 21, 2012","ui_bubble_rating bubble_40,ratingDate relativeDate",Almost right,4.0 Star Hotel
2101 North Epcot Resorts Boulevard,Disney's BoardWalk Inn,"Orlando, FL 32830-8442",39,Lake Buena Vista,Stayed at the Boardwalk as a Disney Vacation Club (DVC) member on points. We have stayed at this resort on a couple other occasions and had problems on one occasion with a smelly carpet in the room. We requested a room change and had to...,"April 23, 2012","ui_bubble_rating bubble_20,ratingDate relativeDate",TERRIBLE Customer Service,4.0 Star Hotel
2101 North Epcot Resorts Boulevard,Disney's BoardWalk Inn,"Orlando, FL 32830-8442",80,Lake Buena Vista,"Recently completed 6 nights at the Boardwalk Inn and reading some of the previous rooms I wonder if I had the same resort.
Firstly the positives,the hotel is very stunning and the grounds immaculate. I liked the whole boardwalk effect,although I found the dining options...","May 2, 2012","ui_bubble_rating bubble_30,ratingDate relativeDate",Not as great as I was expecting.,4.0 Star Hotel
2101 North Epcot Resorts Boulevard,Disney's BoardWalk Inn,"Orlando, FL 32830-8442",39,Lake Buena Vista,"Two months ago my Husband and I stayed at the Boardwalk Villas side of the Boardwalk Inn & Resort for the second time in as many years. We had debated whether to try a new resort (maybe Bay Lake Towers or Wilderness Lodge), but ultimately...","May 23, 2012","ui_bubble_rating bubble_50,ratingDate relativeDate",Disney Perfection,4.0 Star Hotel
2101 North Epcot Resorts Boulevard,Disney's BoardWalk Inn,"Orlando, FL 32830-8442",16,Lake Buena Vista,"Originally my 11 y.o. son and I had booked a room at the Walt Disney World Dolphin Hotel for the Memorial Day weekend. However, upon checking in and observing the condition of The Dolphin Hotel, I immediately called Disney's Boardwalk Inn (which is just a...","May 31, 2012","ui_bubble_rating bubble_50,ratingDate relativeDate",Perfection!,4.0 Star Hotel
2101 North Epcot Resorts Boulevard,Disney's BoardWalk Inn,"Orlando, FL 32830-8442",83,Lake Buena Vista,"THE BEST:
All in all comfortable rooms and public areas.
Staff very attentive.
Location can't be beat. Within easy walking distance to two Disney parks.
THE WORST:
It rained the entire time we were there; to get a drink or something to eat you have...","June 9, 2012","ui_bubble_rating bubble_40,ratingDate relativeDate",Would return to the Boardwalk- especially for a sunny vacation.,4.0 Star Hotel
2101 North Epcot Resorts Boulevard,Disney's BoardWalk Inn,"Orlando, FL 32830-8442",41,Lake Buena Vista,"We stayed here twice in 2011, as a change from Animal Kingdom Lodge.
First time we had a wheelchair room on the 3rd floor. Shower has lip that interferes with shower wheelchair, but can be managed. Second time was on the 2nd floor - no...","April 20, 2012","ui_bubble_rating bubble_40,ratingDate relativeDate","Location, Location, Location. Good Wheelchair Room. Great Staff.",4.0 Star Hotel
2101 North Epcot Resorts Boulevard,Disney's BoardWalk Inn,"Orlando, FL 32830-8442",35,Lake Buena Vista,"I've been to Disney World many times and lived in the Disney developed town of Celebration for a couple of years, so I know Disney World well. My favorite location to stay is the Epcot Resorts area because I usually end up at Epcot at...","April 18, 2012","ui_bubble_rating bubble_40,ratingDate relativeDate",Overall a good experience but expected an excellent one,4.0 Star Hotel
2101 North Epcot Resorts Boulevard,Disney's BoardWalk Inn,"Orlando, FL 32830-8442",18,Lake Buena Vista,"We stayed in a waterview room earlier this year. We were above the Boardwalk and having stayed across the water last year, we were excited to try out this property. The location is very convenient and the property is very nice. Well maintained and clean....","April 16, 2012","ui_bubble_rating bubble_40,ratingDate relativeDate","Great location, some noise, excellent service",4.0 Star Hotel
2101 North Epcot Resorts Boulevard,Disney's BoardWalk Inn,"Orlando, FL 32830-8442",63,Lake Buena Vista,"No doubt, Disney can be an expensive vacation, and the Boardwalk is no exception. But the Boardwalk exceeded my expectations in every way. And while it was already a special occasion for us to stay at a deluxe resort, we splurged for the club level...","April 16, 2012","ui_bubble_rating bubble_50,ratingDate relativeDate",Outstanding resort,4.0 Star Hotel
2101 North Epcot Resorts Boulevard,Disney's BoardWalk Inn,"Orlando, FL 32830-8442",68,Lake Buena Vista,"We stayed at the Boardwalk Inn April 6-12, 2012 & really had a great time. The hotel itself is lovely w/ all the victorian touches, the pastel colors & overstuffed furniture made it a great place to come ""home"" to after a long day at...","April 23, 2012","ui_bubble_rating bubble_50,ratingDate relativeDate",Really enjoyed our stay at The Boardwalk Inn,4.0 Star Hotel
2101 North Epcot Resorts Boulevard,Disney's BoardWalk Inn,"Orlando, FL 32830-8442",95,Lake Buena Vista,"This was our first experience with staying onsite at a Disney property. We were not disappointed and very impressed with the service, room accomodations and location of the Boardwalk.
First, we stayed at a ""cottage suite"" which has 2 levels. The downstairs is the living...","April 22, 2012","ui_bubble_rating bubble_50,ratingDate relativeDate",A Fabulous Experience,4.0 Star Hotel
2101 North Epcot Resorts Boulevard,Disney's BoardWalk Inn,"Orlando, FL 32830-8442",9,Lake Buena Vista,"We stayed at the Boardwalk in again this year. We have 3 children so our accomodation choices are limited at Disney. We stayed once again in the Deluxe Club Level room and once agian it was awesome. First, the Club Level is the only way...","April 21, 2012","ui_bubble_rating bubble_50,ratingDate relativeDate",Absolutly amazing... once again,4.0 Star Hotel
2101 North Epcot Resorts Boulevard,Disney's BoardWalk Inn,"Orlando, FL 32830-8442",55,Lake Buena Vista,"We had the best experience at Disney's Boardwalk Inn last week and probably rank this resort up there with our top 5 favorites. We've stayed at many of the Disney resorts and over the years have come to expect ""just mediocre."" Well, Disney has won...","April 29, 2012","ui_bubble_rating bubble_50,ratingDate relativeDate",WOW....WOW...WOW,4.0 Star Hotel
2101 North Epcot Resorts Boulevard,Disney's BoardWalk Inn,"Orlando, FL 32830-8442",6,Lake Buena Vista,"we stayed at the boardwalk for 2 nights last weekend. it was a great experience. we were able to walk to epcot (3 minute walk) and walk to hollywood studios (6 minute walk). the bus ride to the magic kingdom was a little long, mostly...","April 27, 2012","ui_bubble_rating bubble_50,ratingDate relativeDate",great experience,4.0 Star Hotel
2101 North Epcot Resorts Boulevard,Disney's BoardWalk Inn,"Orlando, FL 32830-8442",39,Lake Buena Vista,"Stayed at Disney Boardwalk on business. There is a certain level of consistency Disney delivers and the Boardwalk was on target again. Clean well kept room really good service and delightful to inter act with the Disney ""Cast and Crew"". Keep up the good work.","April 26, 2012","ui_bubble_rating bubble_40,ratingDate relativeDate",Always Good,4.0 Star Hotel
