Add,Hotel,Zip,badgetext,extendadd,partial_entry,ratingDate,ratingbubble,review_title,stars2101 North Epcot Resorts Boulevard,Disney's BoardWalk Inn,"Orlando, FL 32830-8442",6,Lake Buena Vista,Friend & I took all our granddaughters to the magical place on earth & had a very memorable experience @ the boardwalk inn club level! The experience was fantastic from the lovely room to the club level lounge for breakfast and snacks & drinks every...,"July 13, 2015","ui_bubble_rating bubble_50,ratingDate relativeDate",Excellent stay @ disneyworld,4.0 Star Hotel
2101 North Epcot Resorts Boulevard,Disney's BoardWalk Inn,"Orlando, FL 32830-8442",7,Lake Buena Vista,"We stayed for a week in the hotel before a cruise, as Disney hotels go it great for families, plenty to entertain the family at night on the boardwalk. Easy reach for Epcot and Hollywood studios. A must for Disney lovers","July 19, 2015","ui_bubble_rating bubble_50,ratingDate relativeDate",Amazing Disney,4.0 Star Hotel
2101 North Epcot Resorts Boulevard,Disney's BoardWalk Inn,"Orlando, FL 32830-8442",2,Lake Buena Vista,"This hotel was the best they are so welcoming and courteous to everyone they gave my family the most magical experience ever. Myself and the children wanted to stay longer. The hotel is excellent very clean , nice, and the staff is great. the gave...","July 27, 2015","ui_bubble_rating bubble_50,ratingDate relativeDate",frozen summer fun,4.0 Star Hotel
2101 North Epcot Resorts Boulevard,Disney's BoardWalk Inn,"Orlando, FL 32830-8442",45,Lake Buena Vista,"I have been wanting to visit Boardwalk for a long time. We stayed 2 nights 2 queen standard view. What a view, requested high floor with view of Eiffel Tower and got that on 4th floor, near elevator but noise was minimal and I am...","June 9, 2015","ui_bubble_rating bubble_50,ratingDate relativeDate",First time finally!,4.0 Star Hotel
2101 North Epcot Resorts Boulevard,Disney's BoardWalk Inn,"Orlando, FL 32830-8442",12,Lake Buena Vista,Just finished a business trip here where I brought my entire family. This is probably the 10th different place thay we have stayed on or around Disney. This is by far the best of them all. When you arrive you are met by someone outside...,"June 7, 2015","ui_bubble_rating bubble_50,ratingDate relativeDate",First Class everything,4.0 Star Hotel
2101 North Epcot Resorts Boulevard,Disney's BoardWalk Inn,"Orlando, FL 32830-8442",107,Lake Buena Vista,As you walk in the lobby it is stunning. Had no problem checking in only problem resort is big and I think we had the very last room on the very top floor far from everything. When I take a vacation I dont want to...,"June 2, 2015","ui_bubble_rating bubble_50,ratingDate relativeDate",Stunning,4.0 Star Hotel
2101 North Epcot Resorts Boulevard,Disney's BoardWalk Inn,"Orlando, FL 32830-8442",273,Lake Buena Vista,I stayed here on business for 4 nights. The hotel is in a great location. The hotel rooms are situated all around the boardwalk area. Just imagine all the walking that has to be done to go from the lobby area to the furthest room....,"June 19, 2015","ui_bubble_rating bubble_40,ratingDate relativeDate",Great Location for Epcot and Hollywood Studios,4.0 Star Hotel
2101 North Epcot Resorts Boulevard,Disney's BoardWalk Inn,"Orlando, FL 32830-8442",42,Lake Buena Vista,"This was going to be our third stay at Disney's BoardWalk. When you book a hotel long in advance for a nice room overlooking the water, you don't expect the miserable service we experienced before transferring hotels to the Grand Floridian. Let me explain: we...","June 18, 2015","ui_bubble_rating bubble_10,ratingDate relativeDate",Walt would be very disappointed...,4.0 Star Hotel
2101 North Epcot Resorts Boulevard,Disney's BoardWalk Inn,"Orlando, FL 32830-8442",25,Lake Buena Vista,"I normally stay at the Polynesian, but since it's under construction, I booked in at the BoardWalk Inn. It was absolutely perfect. The location cannot be beat. The pool is incredible and they even have a quiet pool. There are many restaurants and bars on...","June 15, 2015","ui_bubble_rating bubble_50,ratingDate relativeDate",Makes Disney Even More Magical,4.0 Star Hotel
2101 North Epcot Resorts Boulevard,Disney's BoardWalk Inn,"Orlando, FL 32830-8442",18,Lake Buena Vista,"I have been to Disney many time, but this was my worst experience by far. The staff at this hotel is VERY ""Undisney"". They are not friendly, not helpful, not happy and not quick to help. Plus, the breakfast options at this hotel are terrible.","June 15, 2015","ui_bubble_rating bubble_30,ratingDate relativeDate",Not Very DIsney,4.0 Star Hotel
2101 North Epcot Resorts Boulevard,Disney's BoardWalk Inn,"Orlando, FL 32830-8442",9,Lake Buena Vista,"Best experience that I have ever had staying at Disney. The room was excellent, staff was very courteous, and I can't say enough about how easy it is to get to Epcot! The shops and restaurants at the Boardwalk aren't the best, but the location...","June 24, 2015","ui_bubble_rating bubble_50,ratingDate relativeDate","Great room, great service, awesome location",4.0 Star Hotel
2101 North Epcot Resorts Boulevard,Disney's BoardWalk Inn,"Orlando, FL 32830-8442",9,Lake Buena Vista,"Our family of five stayed at this property for six days. It was a smaller property, but we did see why people enjoyed it. We thought the best feature was its close proximity to the Boardwalk itself, Epcot and Hollywood Studios. We were put into...","June 22, 2015","ui_bubble_rating bubble_40,ratingDate relativeDate",Intimate Inn,4.0 Star Hotel
2101 North Epcot Resorts Boulevard,Disney's BoardWalk Inn,"Orlando, FL 32830-8442",31,Lake Buena Vista,"We booked a 3 night trip after our week long cruise on the Disney Fantasy (wonderful!!). We were dropped off early at the Boardwalk through the cruise line connection - we knew our room would not be ready this early, so we had lunch and...","June 21, 2015","ui_bubble_rating bubble_30,ratingDate relativeDate",Charming atmosphere but beware!,4.0 Star Hotel
2101 North Epcot Resorts Boulevard,Disney's BoardWalk Inn,"Orlando, FL 32830-8442",3,Lake Buena Vista,"At first, my family of 3 was put into a king room. I went back to the front desk and told her that I love my 15 year old dearly but we can not all stay in a king bed. Woman at the front desk...","June 29, 2015","ui_bubble_rating bubble_50,ratingDate relativeDate",PERFECTION!,4.0 Star Hotel
2101 North Epcot Resorts Boulevard,Disney's BoardWalk Inn,"Orlando, FL 32830-8442",2,Lake Buena Vista,"My family of 5 had an outstanding stay in the Innkeeper's Club at Boardwalk. We were greeted by name off of the Magical Express, had excellent breakfast, snacks, coffee and cordials in the lounge, and had great fun at the pool and Community Center. As...","June 27, 2015","ui_bubble_rating bubble_50,ratingDate relativeDate",Boardwalk Inn Perfection,4.0 Star Hotel
2101 North Epcot Resorts Boulevard,Disney's BoardWalk Inn,"Orlando, FL 32830-8442",2,Lake Buena Vista,"If location is important to you for Epcot and Disney's Hollywood Studios then this is the place for you. We stayed during June in a Club Level Cottage to attend Star Wars Weekends and we were thoroughly impressed. The club level service was great, as...","June 26, 2015","ui_bubble_rating bubble_50,ratingDate relativeDate",Great Location for Epcot and Hollywood Studios,4.0 Star Hotel
2101 North Epcot Resorts Boulevard,Disney's BoardWalk Inn,"Orlando, FL 32830-8442",13,Lake Buena Vista,"Stayed in room 4302 , concierge level . Room was a good size with 2 queen sized beds and a sofa-bed . Our room overlooked a lovely quiet garden with good views of the fireworks at Epcot. Concierge level was worth the extra cost and...","June 25, 2015","ui_bubble_rating bubble_50,ratingDate relativeDate",Great base to explore Disneyworld,4.0 Star Hotel
2101 North Epcot Resorts Boulevard,Disney's BoardWalk Inn,"Orlando, FL 32830-8442",10,Lake Buena Vista,"I was pleasantly surprised with the Boardwalk. The location was perfect for our weekend pre-cruise stay. We went to Epcot and Hollywood studios, both of which are an easy walk (especially Epcot). We did take the boat from Hollywood in the afternoon. The boardwalk area...","July 7, 2015","ui_bubble_rating bubble_50,ratingDate relativeDate",Great place to stay,4.0 Star Hotel
2101 North Epcot Resorts Boulevard,Disney's BoardWalk Inn,"Orlando, FL 32830-8442",68,Lake Buena Vista,"We loved this hotel for a number of reasons. First, it's totally Disney, so the staff bends over backwards to please you. It's immaculately clean and easily accessible. It's not a giant kids' hotel so, as a couple traveling without children, we didn't have to...","July 6, 2015","ui_bubble_rating bubble_50,ratingDate relativeDate",Fabulous Stay A Quick Boat Ride from Paris. ,4.0 Star Hotel
2101 North Epcot Resorts Boulevard,Disney's BoardWalk Inn,"Orlando, FL 32830-8442",5,Lake Buena Vista,"Not a huge fan of the Boardwalk itself since it's basically just a few bars and restaurants. Great theme and really nice staff, however they are completely uninformed on important information that caused us a really chaotic and confusing stay. The staff sent us to...","July 5, 2015","ui_bubble_rating bubble_30,ratingDate relativeDate",Great sized standard rooms. Awesome pool. Uninformed employees cause for a confusing and complicated stay. ,4.0 Star Hotel
2101 North Epcot Resorts Boulevard,Disney's BoardWalk Inn,"Orlando, FL 32830-8442",8,Lake Buena Vista,"We stayed at the boardwalk in July 2014 for my golden birthday! It was marvelous! When we got to the hotel one cast member came to our car and actually helped us unload the car, while he was helping us I went with my mom...","July 5, 2015","ui_bubble_rating bubble_50,ratingDate relativeDate",THE BEST HOTEL AT DISNEY!,4.0 Star Hotel
2101 North Epcot Resorts Boulevard,Disney's BoardWalk Inn,"Orlando, FL 32830-8442",12,Lake Buena Vista,We stayed at this hotel for the first time. It is a beautiful hotel in a beautiful setting and very convenient to EPCOT and Disney Studios. The pool slide is terrific as it looks like an old wooden roller coaster.,"July 2, 2015","ui_bubble_rating bubble_50,ratingDate relativeDate",Beautiful Hotel and Setting,4.0 Star Hotel
2101 North Epcot Resorts Boulevard,Disney's BoardWalk Inn,"Orlando, FL 32830-8442",3,Lake Buena Vista,"small problem at checkin, taken care of quickly. Lovely property.Room was immaculate. Close to Epcot. Loved the quiet pool.Be prepared to walk a LONG way to your room. Very helpful staff. nice to walk on the boardwalk,get a Margarita, a beer, or a pretzel (although...","July 1, 2015","ui_bubble_rating bubble_50,ratingDate relativeDate","Nice, really nice place.",4.0 Star Hotel
2101 North Epcot Resorts Boulevard,Disney's BoardWalk Inn,"Orlando, FL 32830-8442",19,Lake Buena Vista,"Stayed here for a couple of nights in September. This hotel is amazing! The rooms were incredible, so spacious, two massive beds that cater for 2 people in each bed. The rooms also had a lovely spacious wardrobe and dressing table. Also a beautiful balcony....","July 1, 2015","ui_bubble_rating bubble_50,ratingDate relativeDate","Excellent hotel, great location",4.0 Star Hotel
2101 North Epcot Resorts Boulevard,Disney's BoardWalk Inn,"Orlando, FL 32830-8442",4,Lake Buena Vista,"Check in was so easy! We were met outside by an employee and they handled everything! The boardwalk is so charming! It even comes alive when it is raining! And if the rain is too much, they bring the entertainment inside! The pool and poolside...","June 30, 2015","ui_bubble_rating bubble_50,ratingDate relativeDate",Wonderful experience,4.0 Star Hotel
2101 North Epcot Resorts Boulevard,Disney's BoardWalk Inn,"Orlando, FL 32830-8442",7,Lake Buena Vista,"My family and I enjoyed the fireworks, the boardwalk games, the pool,etc. Our favortie thing was probably the walkway to Epcot. You dont have to wait around for a bus! We also loved the fireworks at Epcot. We could see them right from our room....","July 13, 2015","ui_bubble_rating bubble_50,ratingDate relativeDate",Stunning ,4.0 Star Hotel
2101 North Epcot Resorts Boulevard,Disney's BoardWalk Inn,"Orlando, FL 32830-8442",170,Lake Buena Vista,We have stayed at the Beach Club many times and decided to try something a little different and a little less expencive. It is still a very close walk to EPCOT but need a better way to go from ground floor rooms out to boardwalk....,"July 11, 2015","ui_bubble_rating bubble_50,ratingDate relativeDate",Very nice resort,4.0 Star Hotel
2101 North Epcot Resorts Boulevard,Disney's BoardWalk Inn,"Orlando, FL 32830-8442",26,Lake Buena Vista,"My family stayed here in October 2014 during the food and wine festival. It is a nice enough hotel and conveniently located near Epcot and Hollywood Studios. Our room was spacious, clean, and had a nice balcony. The pool was fun and our kids enjoyed...","July 9, 2015","ui_bubble_rating bubble_40,ratingDate relativeDate",Good location,4.0 Star Hotel
2101 North Epcot Resorts Boulevard,Disney's BoardWalk Inn,"Orlando, FL 32830-8442",5,Lake Buena Vista,"We stayed in Disney's Boardweek in in the last week of June and had a fantastic time. the hotel has a fantastic location on a lake with attractions and restaurants at close hand. it's very atmospheric at night with lots of people, entertainment etc. Both...","July 8, 2015","ui_bubble_rating bubble_40,ratingDate relativeDate",Great location but typical Disney hotel,4.0 Star Hotel
2101 North Epcot Resorts Boulevard,Disney's BoardWalk Inn,"Orlando, FL 32830-8442",13,Lake Buena Vista,"We stayed for a week at the Boardwalk and loved the location. There is so much to do along the boardwalk, we really loved the activities at night. They have a really large pool with a slide that the kids loved. You can also walk...","July 19, 2015","ui_bubble_rating bubble_50,ratingDate relativeDate",Great location and beautiful hotel,4.0 Star Hotel
2101 North Epcot Resorts Boulevard,Disney's BoardWalk Inn,"Orlando, FL 32830-8442",3,Lake Buena Vista,Disney's Boardwalk Inn provides the perfect location to maximize your Disney stay. It offers you the opportunity to take a short walk to get to Disney Studios or Epcot. You can also use the boats to get to either park. This feature helped us save...,"July 18, 2015","ui_bubble_rating bubble_40,ratingDate relativeDate",Wonderful location helps maximize your Disney stay.,4.0 Star Hotel
2101 North Epcot Resorts Boulevard,Disney's BoardWalk Inn,"Orlando, FL 32830-8442",66,Lake Buena Vista,"Pure Disney magic at this resort! It's best in class! Stay here anytime you have the opportunity! Great pools, fantastic rooms, superb dining options for families and/or couples, and stellar customer service! Perfect ambiance! Worth every penny!","July 14, 2015","ui_bubble_rating bubble_50,ratingDate relativeDate",pure Disney magic,4.0 Star Hotel
2101 North Epcot Resorts Boulevard,Disney's BoardWalk Inn,"Orlando, FL 32830-8442",58,Lake Buena Vista,"I have to say I'm a bit annoyed at Disney---I have spent thousands at Disney over the years and I booked a $300/nite room, hoping to have an upgrade to a boardwalk view for my mother and my son, and I get the usual lie...","July 14, 2015","ui_bubble_rating bubble_40,ratingDate relativeDate",Good location but room needs updating......,4.0 Star Hotel
2101 North Epcot Resorts Boulevard,Disney's BoardWalk Inn,"Orlando, FL 32830-8442",11,Lake Buena Vista,What an amazing hotel with plenty of old world charm. This Coney Island inspired hotel is absolutely beautiful. Of an evening you will find plenty entertainment with the foyers often visited by jugglers and magicians. It is also home to one of the largest waterslides...,"July 24, 2015","ui_bubble_rating bubble_50,ratingDate relativeDate",Magical with the best waterslide!,4.0 Star Hotel
2101 North Epcot Resorts Boulevard,Disney's BoardWalk Inn,"Orlando, FL 32830-8442",3,Lake Buena Vista,"My husband and I went to Star Wars weekend and stayed at the beautiful Boardwalk Inn. Since it is reminiscent of Atlantic City in the 1920s, and we're from NJ, it almost felt like being home. It's always a good time at Disney!","July 23, 2015","ui_bubble_rating bubble_50,ratingDate relativeDate",Beautiful area!,4.0 Star Hotel
2101 North Epcot Resorts Boulevard,Disney's BoardWalk Inn,"Orlando, FL 32830-8442",41,Lake Buena Vista,"Our family until our most recent stay loves everything Disney. To put
that into context, I have gone to great lengths to emulate Disney’s
marvelous customer service in the business that I own. Additionally, I search for Disney’s
""secret sauce"" in any book that is...","July 22, 2015","ui_bubble_rating bubble_10,ratingDate relativeDate",Disney's Boardwalk of Shame,4.0 Star Hotel
2101 North Epcot Resorts Boulevard,Disney's BoardWalk Inn,"Orlando, FL 32830-8442",45,Lake Buena Vista,"This hotel is absolutely beautiful and picturesque. It's elegant, but not ""stuffy."" We checked in before noon. They gave us our room request--5th floor garden view and close to the elevator. If you want a quiet room away from the noise of the boardwalk, request...","July 21, 2015","ui_bubble_rating bubble_50,ratingDate relativeDate","Convenient, beautiful hotel! We had a wonderful stay!",4.0 Star Hotel
2101 North Epcot Resorts Boulevard,Disney's BoardWalk Inn,"Orlando, FL 32830-8442",23,Lake Buena Vista,"Our son booked our hotel rooms, using the military discount. We arrived early via the ""Magical Express"" and we were able to check-in and go directly to one of the rooms. Both rooms were on the upper level overlooking the boardwalk. Rooms were clean and...","June 20, 2015","ui_bubble_rating bubble_40,ratingDate relativeDate",Good location for Disney,4.0 Star Hotel
2101 North Epcot Resorts Boulevard,Disney's BoardWalk Inn,"Orlando, FL 32830-8442",6,Lake Buena Vista,Great Disney hotel---all you've come to expect from Disney. LOVED how close it was to EPCOT and Hollywood Studios. We were there in July 2015 when crowd levels are high so we didn't want to have to depend on buses or sit on crowded buses....,"August 5, 2015","ui_bubble_rating bubble_50,ratingDate relativeDate",Close to EPCOT,4.0 Star Hotel
2101 North Epcot Resorts Boulevard,Disney's BoardWalk Inn,"Orlando, FL 32830-8442",202,Lake Buena Vista,"i have stayed at a number of Disney properties over the years, mostly deluxe or moderate properties. Even when staying at the moderate properties, I have always been impressed by the well trained staff; almost to the Ritz Carlton level. This property was definitely the...","August 3, 2015","ui_bubble_rating bubble_20,ratingDate relativeDate","Great location, terrible service",4.0 Star Hotel
2101 North Epcot Resorts Boulevard,Disney's BoardWalk Inn,"Orlando, FL 32830-8442",2,Lake Buena Vista,"Recently stayed four days at Boardwalk with my family. First, the boardwalk, restaurants and retail is a clever themed area within Disney. Second, couldn't ask for a better location-- walkable to Disney studios and Epcot. Finally, hotel is very nice and great staff. Rooms are...","August 14, 2015","ui_bubble_rating bubble_50,ratingDate relativeDate",Great staff and location!,4.0 Star Hotel
2101 North Epcot Resorts Boulevard,Disney's BoardWalk Inn,"Orlando, FL 32830-8442",28,Lake Buena Vista,"This hotel is perfect for a family with teens, not sure about little ones. Easy to get to all the parks, super easy to walk to Epcot. I really appreciated the quiet pool area. The Boardwalk area was fun. No really good breakfast options, but...","August 21, 2015","ui_bubble_rating bubble_50,ratingDate relativeDate","Great location, we had a blast!",4.0 Star Hotel
2101 North Epcot Resorts Boulevard,Disney's BoardWalk Inn,"Orlando, FL 32830-8442",3,Lake Buena Vista,"What can i say,I have no complaints this year. This is our 3rd consecutive year staying at the Boardwalk .This experience was the best so far. We stayed in room 5298 from 8-18-15 through 8-26-15.Its the first time we had a view of Epcot.How great...","September 5, 2015","ui_bubble_rating bubble_50,ratingDate relativeDate",Third Times a charm.,4.0 Star Hotel
2101 North Epcot Resorts Boulevard,Disney's BoardWalk Inn,"Orlando, FL 32830-8442",4,Lake Buena Vista,"We've been to Disney several times and will only stay at the Disney Resorts. Once you do it, you can't go back. This time we decided to try Boardwalk. We got a lagoon front room so we overlooked the lagoon and the boardwalk. Only way...","September 15, 2015","ui_bubble_rating bubble_50,ratingDate relativeDate","As usual, another Disney Resort Delivers",4.0 Star Hotel
2101 North Epcot Resorts Boulevard,Disney's BoardWalk Inn,"Orlando, FL 32830-8442",4,Lake Buena Vista,"We moved from a Villa Studio to a 2 Queen bed room at the Boardwalk Inn and were completely satisfied. This room was much nicer (a little dinge in the bathroom but nothing too bad). The elevators were cleaner, the hallways much nicer and all...","September 21, 2015","ui_bubble_rating bubble_50,ratingDate relativeDate",Much happier at BW Inn over Villas ,4.0 Star Hotel
2101 North Epcot Resorts Boulevard,Disney's BoardWalk Inn,"Orlando, FL 32830-8442",51,Lake Buena Vista,"We loved our stay at the Boardwalk. We were fortunate to have a room that faced the boardwalk yet we only paid for a standard view. As well, our room was close to the elevator so we didn't have the long hallway walks that some...","August 29, 2015","ui_bubble_rating bubble_50,ratingDate relativeDate",A Great Stay,4.0 Star Hotel
2101 North Epcot Resorts Boulevard,Disney's BoardWalk Inn,"Orlando, FL 32830-8442",21,Lake Buena Vista,Our second trip to disney world in a years time was for our enchanted honeymoon. Beatifully decorated room with big comfy bed with SUPERIOR SERVICE is what we found here . A definite return in the future !!!!,"September 9, 2015","ui_bubble_rating bubble_50,ratingDate relativeDate",Honeymoon Wishes Come True,4.0 Star Hotel
2101 North Epcot Resorts Boulevard,Disney's BoardWalk Inn,"Orlando, FL 32830-8442",62,Lake Buena Vista,"We love, love, love this Disney resort. Our family of 4 stayed here the end of July and you can't beat the location. A short walk or boat ride to the back entrance of Epcot, or a boat ride away from Disney's Hollywood Studios. Hotel...","August 3, 2015","ui_bubble_rating bubble_50,ratingDate relativeDate",The perfect location!,4.0 Star Hotel
2101 North Epcot Resorts Boulevard,Disney's BoardWalk Inn,"Orlando, FL 32830-8442",15,Lake Buena Vista,We had a lovely one night stay at Disney's Boardwalk Inn 2 weeks ago. Although our room had to have been 1/4 of a mile from the lobby it was worth the walk. The room was decorated beautifully and everything including the bathroom was spotless....,"July 30, 2015","ui_bubble_rating bubble_50,ratingDate relativeDate",Lovely Surprise!,4.0 Star Hotel
2101 North Epcot Resorts Boulevard,Disney's BoardWalk Inn,"Orlando, FL 32830-8442",54,Lake Buena Vista,"If you want to spend time at Epcot, this is a perfect location. You can walk there. This is a clean and welcoming hotel. The room was very nice, bed was comfortable. The Disney bus service from the airport was very convenient and buses run...","July 29, 2015","ui_bubble_rating bubble_40,ratingDate relativeDate",Great Location,4.0 Star Hotel
2101 North Epcot Resorts Boulevard,Disney's BoardWalk Inn,"Orlando, FL 32830-8442",11,Lake Buena Vista,"We've stayed in them all. Every club level at all the resorts in Disney. Hands down the best experience available. Short boat ride to EPCOT and Hollywood Studios. Longer bus ride to the other parks. Get a room facing the lake, and watch EPCOT fireworks...","August 12, 2015","ui_bubble_rating bubble_50,ratingDate relativeDate",Best Club Level Experience in Disney.,4.0 Star Hotel
2101 North Epcot Resorts Boulevard,Disney's BoardWalk Inn,"Orlando, FL 32830-8442",160,Lake Buena Vista,"We just spent five nights in Room 2312, which was an accessible room with a roll in shower and a king. It was a wonderful room, quiet and very clean. And within a reasonable walking distance to the lobby on the second floor.
Our problem...","August 11, 2015","ui_bubble_rating bubble_40,ratingDate relativeDate","A wonderful place to visit, but eating there is another matter!",4.0 Star Hotel
2101 North Epcot Resorts Boulevard,Disney's BoardWalk Inn,"Orlando, FL 32830-8442",3,Lake Buena Vista,"Just came back from our vacation at the Boardwalk and I have to say I will be booking again next time, from arrival to checking out the staff were fantastic. The room was spacious and nicely decorated. I like the idea of staying in a...","August 9, 2015","ui_bubble_rating bubble_50,ratingDate relativeDate",Great stay,4.0 Star Hotel
2101 North Epcot Resorts Boulevard,Disney's BoardWalk Inn,"Orlando, FL 32830-8442",91,Lake Buena Vista,"The staff were very friendly and helpful any time I had a question, but for the price I paid for the room, I was disappointed. I was in town for a conference, so thankfully work paid for everything, but the conference was across the pond...","August 7, 2015","ui_bubble_rating bubble_30,ratingDate relativeDate",Save your money and stay somewhere else,4.0 Star Hotel
2101 North Epcot Resorts Boulevard,Disney's BoardWalk Inn,"Orlando, FL 32830-8442",9,Lake Buena Vista,Disney never fails to deliver quality and the Boardwalk is included. Great stay but would also try Dolphin next time as their restaurants seemed to be easier access (don't need to walk outside) which is just a personal thing.,"August 19, 2015","ui_bubble_rating bubble_50,ratingDate relativeDate",Typical Disney Exerience - Excellent,4.0 Star Hotel
