Add,Hotel,Zip,badgetext,extendadd,partial_entry,ratingDate,ratingbubble,review_title,stars
2101 North Epcot Resorts Boulevard,Disney's BoardWalk Inn,"Orlando, FL 32830-8442",18,Lake Buena Vista,"When we come to Disney we like to stay near Epcot so we can pop over to Epcot for a dinner in a different country every night.
What I love about staying on the Disney property when I go to Disney World is that they...","April 12, 2017","ui_bubble_rating bubble_50,ratingDate relativeDate",A piece of the Shore at Disney,4.0 Star Hotel
2101 North Epcot Resorts Boulevard,Disney's BoardWalk Inn,"Orlando, FL 32830-8442",10,Lake Buena Vista,"Embedded with luxury Victorian style, the BoardWalk Inn is simply a gorgeous place to stay. Wish to come back and have a longer stay next time!
Each room is attached to an extended balcony with enticing view, the lobby, the hallway and the lounge elegantly...","May 3, 2017","ui_bubble_rating bubble_50,ratingDate relativeDate",BoardWalk Inn - A real home away home,4.0 Star Hotel
2101 North Epcot Resorts Boulevard,Disney's BoardWalk Inn,"Orlando, FL 32830-8442",47,Lake Buena Vista,I stayed at the Boardwalk Inn for the last 3 days and highly recommend it - especially for convenience. I quick boat ride to Epcot or a casual walk makes the location ideal. I didn't have to drive for the entire time. And there were...,"April 10, 2017","ui_bubble_rating bubble_40,ratingDate relativeDate",On the Boardwalk ,4.0 Star Hotel
2101 North Epcot Resorts Boulevard,Disney's BoardWalk Inn,"Orlando, FL 32830-8442",1,Lake Buena Vista,The place really seems like a 3 star hotel and is definitely not somewhere I would stop again. This particular Disney resort is a very bad one in comparison with others. 1) The rooms are small and uncomfortable 2) The Boardwalk is nothing like a...,"April 9, 2017","ui_bubble_rating bubble_30,ratingDate relativeDate",Not worth it,4.0 Star Hotel
2101 North Epcot Resorts Boulevard,Disney's BoardWalk Inn,"Orlando, FL 32830-8442",42,Lake Buena Vista,"We have just come back from 2 weeks at the Boardwalk Inn. We had decided to try this hotel having stayed at the Beach Club across the lake the year before. I have mixed reviews on this hotel, staff couldn't do enough for us, the...","May 1, 2017","ui_bubble_rating bubble_40,ratingDate relativeDate",Great Location!,4.0 Star Hotel
2101 North Epcot Resorts Boulevard,Disney's BoardWalk Inn,"Orlando, FL 32830-8442",14,Lake Buena Vista,"Very nice setting and wonderful atmosphere but overpriced ( but I guess everything is in WDW). I was there for a wedding and it was the ""primary"" location for all the guests. The amenities were lovely and all the staff were extraordinary.
I certainly would...","May 1, 2017","ui_bubble_rating bubble_40,ratingDate relativeDate","Lovely, but overpriced",4.0 Star Hotel
2101 North Epcot Resorts Boulevard,Disney's BoardWalk Inn,"Orlando, FL 32830-8442",9,Lake Buena Vista,"Love disney
Hate this place
Terrible expensive food and limited in resort services
Never saw disney character
Only saving grace was it was close to epic
Hotel room And pool was ok
Nothing special
Made me miss the food and cocktail at Hyatt regency cypress...","April 29, 2017","ui_bubble_rating bubble_10,ratingDate relativeDate",Worse experience in culinary,4.0 Star Hotel
2101 North Epcot Resorts Boulevard,Disney's BoardWalk Inn,"Orlando, FL 32830-8442",18,Lake Buena Vista,This resort has so many possibilities but the lack quick food service choices means you are having to make reservations for every meal unless you want a piece of fruit or pastry. Or you are walking over to the Dolphin for made to order cafeteria...,"April 26, 2017","ui_bubble_rating bubble_30,ratingDate relativeDate",Disappointing for the price,4.0 Star Hotel
2101 North Epcot Resorts Boulevard,Disney's BoardWalk Inn,"Orlando, FL 32830-8442",1,Lake Buena Vista,"This is so easy to walk to Epcot Center or use water taxi. Our 5th floor room over looking lake had nice balcony to watch Epcot""s fireworks show. Room was very spacious and modern and clean. The bath area was spacious with double vanity and...","May 17, 2017","ui_bubble_rating bubble_50,ratingDate relativeDate",Disneys Boardwalk Inn easy walk to Epcot,4.0 Star Hotel
2101 North Epcot Resorts Boulevard,Disney's BoardWalk Inn,"Orlando, FL 32830-8442",38,Lake Buena Vista,"This hotel is always within a few dollars of Beach and Yacht Club, yet its pool is not nearly as good. I also find the restaurant options to be better and more varied at B&Y, though the addition of Ample Hills has been great for...","March 31, 2017","ui_bubble_rating bubble_30,ratingDate relativeDate",Stay at Beach or Yacht Club instead,4.0 Star Hotel
2101 North Epcot Resorts Boulevard,Disney's BoardWalk Inn,"Orlando, FL 32830-8442",4,Lake Buena Vista,"The hotel is absolutely beautiful,the staff was great. The only negative I would say is that there is no place to eat breakfast,there are places to eat breakfast as a sit down meal no good place have coffee and read the newspaper. I would stay...","May 7, 2017","ui_bubble_rating bubble_50,ratingDate relativeDate",Very nice place,4.0 Star Hotel
2101 North Epcot Resorts Boulevard,Disney's BoardWalk Inn,"Orlando, FL 32830-8442",10,Lake Buena Vista,"The Boardwalk Inn has a great location. Boats to both Epcot and Hollywood Studios. Also close enough to walk to either of those parks. Plenty of food, shopping and entertainment options available on the boardwalk. We stayed in a 1 bedroom villa with a kitchen...","April 25, 2017","ui_bubble_rating bubble_50,ratingDate relativeDate",Great location with lots of entertainment,4.0 Star Hotel
2101 North Epcot Resorts Boulevard,Disney's BoardWalk Inn,"Orlando, FL 32830-8442",291,Lake Buena Vista,We stayed at Boardwalk Inn for 5 nights for a spring break vacation. We chose Boardwalk due to its location and ease of access to both Epcot and Hollywood Studios. That is one of the best parts of this resort...the ability to walk to both...,"April 7, 2017","ui_bubble_rating bubble_40,ratingDate relativeDate",Can't beat the location but avoid staying on the first floor.,4.0 Star Hotel
2101 North Epcot Resorts Boulevard,Disney's BoardWalk Inn,"Orlando, FL 32830-8442",6,Lake Buena Vista,"Our family visits Disney World every year over spring break. The last two years, we have stayed at the resort across the lake from the Boardwalk, but found ourselves spending much of our free time there, grabbing food, watching performers, and loving the festive, old...","April 7, 2017","ui_bubble_rating bubble_50,ratingDate relativeDate",Our favorite deluxe resort. ,4.0 Star Hotel
2101 North Epcot Resorts Boulevard,Disney's BoardWalk Inn,"Orlando, FL 32830-8442",10,Lake Buena Vista,"Our room had a patio that looked out on a huge lake with lighting at night that made you feel like you were in paradise! We could see fireworks every evening from two parks while we strolled down the Boardwalk that was filled with shops,...","April 7, 2017","ui_bubble_rating bubble_50,ratingDate relativeDate",Best Location in Walt Disney World,4.0 Star Hotel
2101 North Epcot Resorts Boulevard,Disney's BoardWalk Inn,"Orlando, FL 32830-8442",19,Lake Buena Vista,"We LOVED our four night stay at the Boardwalk for spring break. We were magically upgraded to club level when we arrived, which of course impacted our opinion of the property. But even without the upgrade, the facility is meticulously clean, recently renovated, with friendly...","March 23, 2017","ui_bubble_rating bubble_50,ratingDate relativeDate","Disney Service, great location, fabulous property",4.0 Star Hotel
2101 North Epcot Resorts Boulevard,Disney's BoardWalk Inn,"Orlando, FL 32830-8442",56,Lake Buena Vista,"For a company that prides itself on its systems, and communication with guests, a fire alarm at 3:40 am showed it is all sham. No ""cast members"" appeared, no one told guests what to do or where to go. The fire brigade took 45 minutes...","May 15, 2017","ui_bubble_rating bubble_10,ratingDate relativeDate",Dismal systems at Disney,4.0 Star Hotel
2101 North Epcot Resorts Boulevard,Disney's BoardWalk Inn,"Orlando, FL 32830-8442",27,Lake Buena Vista,"My husband and I enjoyed a short trip to Disney April 23-27, 2017. When I was searching for a place to stay, I could not believe my eyes when I scored the discounted Spring room rate offer at Disney's Boardwalk Inn for only $350/night! This...","May 12, 2017","ui_bubble_rating bubble_40,ratingDate relativeDate",Location location location!,4.0 Star Hotel
2101 North Epcot Resorts Boulevard,Disney's BoardWalk Inn,"Orlando, FL 32830-8442",29,Lake Buena Vista,"We stayed for three nights in a quiet room away from the elevator and over looking a courtyard.
The room was great and if you are going to Disney make sure to link your ""my disney"" app with your tickets and hotel.
We booked fast...","March 30, 2017","ui_bubble_rating bubble_50,ratingDate relativeDate",Great epcot hotel,4.0 Star Hotel
2101 North Epcot Resorts Boulevard,Disney's BoardWalk Inn,"Orlando, FL 32830-8442",21,Lake Buena Vista,"This was our second trip to the Boardwalk Area, and we fell in love with it all over again. This time, we stayed in the Boardwalk Inn itself. As you would expect from a premium Disney Resort, it was spectacular. Clean, crisp, and impeccably designed,...","March 29, 2017","ui_bubble_rating bubble_50,ratingDate relativeDate",On the Boardwalk with my Baby-That's where we'll be.,4.0 Star Hotel
2101 North Epcot Resorts Boulevard,Disney's BoardWalk Inn,"Orlando, FL 32830-8442",35,Lake Buena Vista,"This was our first time at a Disney resort, and it was wonderful. My husband was attending a conference, and both our room and the meeting facilities were quite comfortable. Although we didn't try the pool, it looked inviting. The staff were all friendly and...","March 25, 2017","ui_bubble_rating bubble_50,ratingDate relativeDate","Wonderful property, wonderful staff",4.0 Star Hotel
2101 North Epcot Resorts Boulevard,Disney's BoardWalk Inn,"Orlando, FL 32830-8442",13,Lake Buena Vista,This is definitely not a luxury resort by industry standards and the decor was tired. The best thing about the Boardwalk is the location. You can walk to Epcot and Hollywood Studios. It is nice to be able to eat and have entertainment on the...,"March 25, 2017","ui_bubble_rating bubble_30,ratingDate relativeDate",Listed as a luxury resort but not much luxury.,4.0 Star Hotel
2101 North Epcot Resorts Boulevard,Disney's BoardWalk Inn,"Orlando, FL 32830-8442",5,Lake Buena Vista,We love the Boardwalk club level. We stayed at Polynesian club level last year and the boardwalks is so much nicer. We've stayed in the garden villas as well as the club level Boardwalk view rooms and both have been great. Especially a great place...,"May 6, 2017","ui_bubble_rating bubble_50,ratingDate relativeDate",Another great club level visit ,4.0 Star Hotel
2101 North Epcot Resorts Boulevard,Disney's BoardWalk Inn,"Orlando, FL 32830-8442",13,Lake Buena Vista,"My wife and I arrived at the Boardwalk Inn on Friday, April 28th for a three night stay in a Club Level Deluxe Room. As expected our room was not ready but we were told that it was guaranteed for 3:00 PM, so after a...","May 6, 2017","ui_bubble_rating bubble_40,ratingDate relativeDate",Thank You Ellen,4.0 Star Hotel
2101 North Epcot Resorts Boulevard,Disney's BoardWalk Inn,"Orlando, FL 32830-8442",18,Lake Buena Vista,"This resort was very nice but HUGE! The walk to our room took about 7 minutes from the lobby! It doesn't have the traditional feel of a resort because most of the shops, restaurants and bars aren't in the lobby area, they're down along the...","May 4, 2017","ui_bubble_rating bubble_40,ratingDate relativeDate",Very nice resort with a different feel to it,4.0 Star Hotel
2101 North Epcot Resorts Boulevard,Disney's BoardWalk Inn,"Orlando, FL 32830-8442",1,Lake Buena Vista,Great hotel. Beautiful clean large rooms. Very friendly and helpful staff. Walking distance to Epcot center. The boardwalk is great. Lots of fun activities and restaurants and shops. Access to all Disney parks by bus or boat. We had a great time,"May 3, 2017","ui_bubble_rating bubble_50,ratingDate relativeDate",Mrs,4.0 Star Hotel
2101 North Epcot Resorts Boulevard,Disney's BoardWalk Inn,"Orlando, FL 32830-8442",25,Lake Buena Vista,Stayed here for 5 nights. This was a great place to stay - so close to Epcot and the Disney bus service takes you everywhere you might need to go in Disney World - Disney Springs - the Magic Kingdom and more! The room was...,"April 19, 2017","ui_bubble_rating bubble_40,ratingDate relativeDate",A magical time,4.0 Star Hotel
2101 North Epcot Resorts Boulevard,Disney's BoardWalk Inn,"Orlando, FL 32830-8442",22,Lake Buena Vista,"What you would expect from a mid-luxury Disney resort. Good service, a clean room, luxury not forthcoming in the bedrooms but the main hotel guest areas very nice. The main plus point about this hotel is that its 5-10 mins walking into Epcot so you...","April 19, 2017","ui_bubble_rating bubble_40,ratingDate relativeDate",Easy walking distance to Epcot,4.0 Star Hotel
2101 North Epcot Resorts Boulevard,Disney's BoardWalk Inn,"Orlando, FL 32830-8442",68,Lake Buena Vista,"Recently went to the Boardwalk for a conference/family vacation. Have stayed here before but I think this was one of the best stays. I did online check in and noted they had put me in a handicap accessible room which I did not need, so...","April 12, 2017","ui_bubble_rating bubble_50,ratingDate relativeDate",Another great stay at the Boardwalk,4.0 Star Hotel
2101 North Epcot Resorts Boulevard,Disney's BoardWalk Inn,"Orlando, FL 32830-8442",18,Lake Buena Vista,Location is superb with easy walkability to Epcot and 15 minute stroll or boat ride to Hollywood Studios. There are nice food options directly outside the hotel on the Boardwalk. The pool is very clean and enjoyable. Bicycles may be rented on the boardwalk. The...,"April 5, 2017","ui_bubble_rating bubble_20,ratingDate relativeDate",Excellent and fun location with stinky rooms,4.0 Star Hotel
2101 North Epcot Resorts Boulevard,Disney's BoardWalk Inn,"Orlando, FL 32830-8442",1,Lake Buena Vista,"Great places to stop to eat. Arcades for much fun, and great service and lobbies. Allows to me to take the ferry to multiple places and between walking distances to a few parks. I definently recommend this resort for anyone who likes to have fun.","April 5, 2017","ui_bubble_rating bubble_50,ratingDate relativeDate",Amazing,4.0 Star Hotel
2101 North Epcot Resorts Boulevard,Disney's BoardWalk Inn,"Orlando, FL 32830-8442",1,Lake Buena Vista,I am here celebrating a family wedding and everything is top notch from the moment we entered. The service was beautiful and the staff are so accommodating from the music to my snafu. I accidentally broke my high heel shoe and after I showed a...,"April 4, 2017","ui_bubble_rating bubble_50,ratingDate relativeDate",Incredible Services ,4.0 Star Hotel
2101 North Epcot Resorts Boulevard,Disney's BoardWalk Inn,"Orlando, FL 32830-8442",6,Lake Buena Vista,My girlfriend and arrived LATE due to our flight being delayed. The hotel staff was aware of our problem and kept asking if we needed drinks or food before heading to our room. They were extremely hospitable and kind throughout the entire week. The location...,"May 31, 2017","ui_bubble_rating bubble_40,ratingDate relativeDate",Amazing Customer Service,4.0 Star Hotel
2101 North Epcot Resorts Boulevard,Disney's BoardWalk Inn,"Orlando, FL 32830-8442",197,Lake Buena Vista,"Room was spacious but housekeeping was hit or miss. Sometimes we got fresh towels, sometimes they were missing. Sometimes our soap disappeared and wasn't replaced. We had to request more shampoo/conditioner/lotion, but then got a variety of other items one day. Next few days nothing....","March 23, 2017","ui_bubble_rating bubble_40,ratingDate relativeDate",Great location!,4.0 Star Hotel
2101 North Epcot Resorts Boulevard,Disney's BoardWalk Inn,"Orlando, FL 32830-8442",102,Lake Buena Vista,Spent 12 nights in the Boardwalk Inn in March '17. Firstly the hotel is in the middle of EPCOT and DHS. A 15 min walk to the front of DHS and a 10 min walk to World Showcase...not Future World of EPCOT Unfortuantley its 20min...,"March 20, 2017","ui_bubble_rating bubble_30,ratingDate relativeDate",Great Hotel ... Terrible Transport,4.0 Star Hotel
2101 North Epcot Resorts Boulevard,Disney's BoardWalk Inn,"Orlando, FL 32830-8442",19,Lake Buena Vista,Return trip to one of our Disney favorite hotels. We always enjoy the easy access to Epcot and The Studios and the surrounding hotels and restaurants.Bus service is easy and the pools are great.Our only issue as longtime Disney fans is that the price is...,"June 23, 2017","ui_bubble_rating bubble_50,ratingDate relativeDate",One of our favorites,4.0 Star Hotel
2101 North Epcot Resorts Boulevard,Disney's BoardWalk Inn,"Orlando, FL 32830-8442",22,Lake Buena Vista,This trip my wife and I took our two adult children. We had visited twice before as a couple and wanted our kids to experience a truly remarkable resort at Disney.. this was our third stay club level here at the Boardwalk Inn and I...,"July 17, 2017","ui_bubble_rating bubble_50,ratingDate relativeDate",Absolutely perfect! Club level is Top notch,4.0 Star Hotel
2101 North Epcot Resorts Boulevard,Disney's BoardWalk Inn,"Orlando, FL 32830-8442",3,Lake Buena Vista,Our stay here was great. The food and nightlife on the boardwalk was amazing. The hotel looks and feels like you are taking a step back in time when Walt Disney was running the park. Great pool area that provides life jackets for all ages....,"July 28, 2017","ui_bubble_rating bubble_50,ratingDate relativeDate",Summer Trip 2017,4.0 Star Hotel
2101 North Epcot Resorts Boulevard,Disney's BoardWalk Inn,"Orlando, FL 32830-8442",20,Lake Buena Vista,We arrived around noon on a Sat and checked in. Our room wasn't ready yet so they said they'd send us a text when it was ready. We walked around the boardwalk and relaxed in the lobby. Started raining outside so a lifeguard brought coloring...,"July 9, 2017","ui_bubble_rating bubble_30,ratingDate relativeDate",Nice but not worth the money,4.0 Star Hotel
2101 North Epcot Resorts Boulevard,Disney's BoardWalk Inn,"Orlando, FL 32830-8442",28,Lake Buena Vista,My husband and I needed a great location so we could attend the 2015 International Food and Wine Festival at Epcot. What a terrific experience staying on Disney premises for the 1st time. The staff are always friendly and eager to assist. Their welcome when...,"October 27, 2015","ui_bubble_rating bubble_40,ratingDate relativeDate",Beautiful resort right next to Epcot,4.0 Star Hotel
2101 North Epcot Resorts Boulevard,Disney's BoardWalk Inn,"Orlando, FL 32830-8442",19,Lake Buena Vista,"I have stayed Club Level at the Boardwalk many times over the years and have experienced the good, bad and indifferent. I must say that my most recent experience has made me forget what took place in the past. The hotel and really stepped it...","May 20, 2017","ui_bubble_rating bubble_50,ratingDate relativeDate",Fantastic Boardwalk Stay!,4.0 Star Hotel
2101 North Epcot Resorts Boulevard,Disney's BoardWalk Inn,"Orlando, FL 32830-8442",15,Lake Buena Vista,"My family and i was saying at this hotel for a business convention and everything on that side of thing was great, in terms of the ricing and the place where our convention was held. But on the side of a regular traveler i was...","May 9, 2017","ui_bubble_rating bubble_30,ratingDate relativeDate",Creepy robots,4.0 Star Hotel
2101 North Epcot Resorts Boulevard,Disney's BoardWalk Inn,"Orlando, FL 32830-8442",11,Lake Buena Vista,"I stayed at this hotel because I was at a conference at the Swan and Dolphin. The hotel is fairly nice, but I would not recommend this hotel for business travelers. The fireworks start promptly at 9 p.m. each night, and they go for 30-60...","April 12, 2017","ui_bubble_rating bubble_20,ratingDate relativeDate",Not for business travelers!,4.0 Star Hotel
2101 North Epcot Resorts Boulevard,Disney's BoardWalk Inn,"Orlando, FL 32830-8442",222,Lake Buena Vista,"The Boardwalk inn has a beautiful lobby and grounds! The location can't be best. You can walk to both Epcot and HS. There are also ferry boats. Yes u can walk to the yacht & beach club hotels as well.
You restaurants right outside on...","April 4, 2017","ui_bubble_rating bubble_40,ratingDate relativeDate",Not worth the money ... great location,4.0 Star Hotel
2101 North Epcot Resorts Boulevard,Disney's BoardWalk Inn,"Orlando, FL 32830-8442",11,Lake Buena Vista,"To stay at The Boardwalk was definitely a bucket list item for me. I was ecstatic when, upon joining the Disney Vacation Club, I was able to spend 5 days at this resort. It was everything I had hoped it would be, and more The...","May 31, 2017","ui_bubble_rating bubble_50,ratingDate relativeDate",TALK ABOUT MAGIC!!!!!,4.0 Star Hotel
2101 North Epcot Resorts Boulevard,Disney's BoardWalk Inn,"Orlando, FL 32830-8442",27,Lake Buena Vista,"Our family was so excited for our first trip to Disney and we chose the Boardwalk Hotel for its location. Like many other reviews have said, we wanted to love this hotel for many reasons. Through out the stay we had many simple hiccups like...","May 30, 2017","ui_bubble_rating bubble_10,ratingDate relativeDate","Scary, dangerous situation for women",4.0 Star Hotel
2101 North Epcot Resorts Boulevard,Disney's BoardWalk Inn,"Orlando, FL 32830-8442",64,Lake Buena Vista,I really wish I could give this resort a five-star review but we were saddened to find the service and common areas did not meet our expectations of a deluxe accommodation. We chose BoardWalk Inn for its proximity to Epcot and it served us well...,"May 28, 2017","ui_bubble_rating bubble_20,ratingDate relativeDate","Terrible bell service, weddings galore ",4.0 Star Hotel
2101 North Epcot Resorts Boulevard,Disney's BoardWalk Inn,"Orlando, FL 32830-8442",16,Lake Buena Vista,"While not my favorite resort in regards to theming, I love the convenience of the location. Just a 5-minute walk to EPCOT and a 15-minute walk to the Studios. I also enjoy the entertainment on the boardwalk. Lots of great restaurants on the boardwalk and...","March 19, 2017","ui_bubble_rating bubble_50,ratingDate relativeDate",A convenient location,4.0 Star Hotel
2101 North Epcot Resorts Boulevard,Disney's BoardWalk Inn,"Orlando, FL 32830-8442",17,Lake Buena Vista,"Disneys Boardwalk is one of their Luxury Hotels, and in my view it's worth it for the location which is a 5-10 minute walk to the World Showcase ( near England's pavilion). The jugglers and magicians are at the boardwalk right at the end of...","March 16, 2017","ui_bubble_rating bubble_40,ratingDate relativeDate","Walk to Epcot, entertainment at night, what's not to like",4.0 Star Hotel
2101 North Epcot Resorts Boulevard,Disney's BoardWalk Inn,"Orlando, FL 32830-8442",1,Lake Buena Vista,"Generally satisfied with the hotel. The rooms were comfy and clean and the beds were quality. The property is ideally located right next to Epoct, a short walk or boat ride away. The service was excellent and the pool was great. Our kids (boys 6&9)...","June 21, 2017","ui_bubble_rating bubble_40,ratingDate relativeDate",Just back from 4 nights at the Disney boardwalk inn,4.0 Star Hotel
2101 North Epcot Resorts Boulevard,Disney's BoardWalk Inn,"Orlando, FL 32830-8442",7,Lake Buena Vista,I have stayed here twice with my girlfriend and once with my family. The hotel is in the perfect location because you can walk right into Epcot. It only takes 5 minutes. You can also take a long walk to Hollywood Studios or a short...,"June 11, 2017","ui_bubble_rating bubble_50,ratingDate relativeDate",Best place to stay in Disney if you aren't bringing kids,4.0 Star Hotel
2101 North Epcot Resorts Boulevard,Disney's BoardWalk Inn,"Orlando, FL 32830-8442",49,Lake Buena Vista,I booked two rooms prior to a Disney cruise - one for myself and one for my son and his friend. The Boardwalk Inn is a luxury property near Epcot. The rooms were beautiful - one facing the lagoon with a veranda. I had never...,"June 10, 2017","ui_bubble_rating bubble_50,ratingDate relativeDate",Things went wrong and Disney handeled the issues well.,4.0 Star Hotel
2101 North Epcot Resorts Boulevard,Disney's BoardWalk Inn,"Orlando, FL 32830-8442",26,Lake Buena Vista,"Second visit to The Boardwalk and it never disappoints. I've tried lots of other resorts on the Disney property and in my view The Boardwalk tops them all.
The hotel is beautifully maintained, spotless, charming, and very welcoming. The ambience of the lake and the...","July 14, 2017","ui_bubble_rating bubble_50,ratingDate relativeDate",Perfect...again,4.0 Star Hotel
2101 North Epcot Resorts Boulevard,Disney's BoardWalk Inn,"Orlando, FL 32830-8442",4,Lake Buena Vista,Boardwalk is a fantastic location if you want to enjoy easy access to Epcot and Hollywood studios. The evening entertainment on the actual Boardwalk is top notch and family friendly. Eating options abound and the area feels intimate yet deluxe without going over the top...truly...,"July 13, 2017","ui_bubble_rating bubble_40,ratingDate relativeDate","Location, location, location...oh and price...",4.0 Star Hotel
2101 North Epcot Resorts Boulevard,Disney's BoardWalk Inn,"Orlando, FL 32830-8442",122,Lake Buena Vista,My husband and I are frequent guests of Disney World and the Boardwalk is one of our favorite hotels. The location is one of its best features. It’s walkable to both Epcot and Hollywood Studios (5 to 10 min) while the Disney Boardwalk area provides...,"July 26, 2017","ui_bubble_rating bubble_50,ratingDate relativeDate",Fantastic Hotel,4.0 Star Hotel
