Add,Hotel,Zip,badgetext,extendadd,partial_entry,ratingDate,ratingbubble,review_title,stars2101 North Epcot Resorts Boulevard,Disney's BoardWalk Inn,"Orlando, FL 32830-8442",54,Lake Buena Vista,"We've just returned from a 10-day/9-night stay at Disney's Boardwalk Inn, travel dates March 1, 2014-March 10, 2014, and we had the vacation of a lifetime! We traveled as three adults and a child, my husband, my daughter (20), our son (17), and me. We...","March 16, 2014","ui_bubble_rating bubble_50,ratingDate relativeDate","We love, love, LOVE this resort!",4.0 Star Hotel
2101 North Epcot Resorts Boulevard,Disney's BoardWalk Inn,"Orlando, FL 32830-8442",9,Lake Buena Vista,"We loved this resort! Why? Because it has everything you could want in a Disney World resort, especially for adults or families that love Epcot or Hollywood Studios. You can walk to either of them very easily. The rooms are a great size, we had...","March 12, 2014","ui_bubble_rating bubble_50,ratingDate relativeDate",WDW home away from home,4.0 Star Hotel
2101 North Epcot Resorts Boulevard,Disney's BoardWalk Inn,"Orlando, FL 32830-8442",59,Lake Buena Vista,"The cast members that work at all of Disney's resorts and attractions are the nicest, most helpful people. My family and I stayed at the Boardwalk for the runDisney Princess Half Marathon weekend. My two sisters and I shared a studio room and my parents...","February 25, 2014","ui_bubble_rating bubble_50,ratingDate relativeDate","Wonderful Service, Great Location",4.0 Star Hotel
2101 North Epcot Resorts Boulevard,Disney's BoardWalk Inn,"Orlando, FL 32830-8442",6,Lake Buena Vista,I stayed at both the Disney Dolphin and Boardwalk Inn during my stay. Two very different hotels. I would stay at the Boardwalk Inn 100 times over! The hotel felt like a southern plantation- rooms were nice with a great balcony. The staff was VERY...,"February 24, 2014","ui_bubble_rating bubble_50,ratingDate relativeDate",Disney hotel with Southern Hospitality!!!!!!,4.0 Star Hotel
2101 North Epcot Resorts Boulevard,Disney's BoardWalk Inn,"Orlando, FL 32830-8442",33,Lake Buena Vista,"Spent 2 nights at the Boardwalk Inn in mid-February 2014 prior to a cruise on the Disney Magic. Had initially planned to spend one night, however a pending snowstorm in the Northeast caused me to leave a day early. The Boardwalk Inn was able to...","February 24, 2014","ui_bubble_rating bubble_40,ratingDate relativeDate",Pleasant Property,4.0 Star Hotel
2101 North Epcot Resorts Boulevard,Disney's BoardWalk Inn,"Orlando, FL 32830-8442",9,Lake Buena Vista,Boardwalk is one of the top of line Disney hotels. You expect greatness and you get it. Greeting is excellent at registration and my room was ready by 11:30 AM. Room is spotless and the bed is comfortable. Restaurants are right outside front door since...,"February 16, 2014","ui_bubble_rating bubble_50,ratingDate relativeDate",great boardwalk,4.0 Star Hotel
2101 North Epcot Resorts Boulevard,Disney's BoardWalk Inn,"Orlando, FL 32830-8442",87,Lake Buena Vista,"The Boardwalk Inn is my favorite resort on Disney property. I have stayed at every resort on property, and this is a hidden gem! I love the small size of the Inn, and the intimate feeling of it. The resort is so welcoming, the rooms...","March 19, 2014","ui_bubble_rating bubble_50,ratingDate relativeDate",A Hidden Gem! My Favorite!,4.0 Star Hotel
2101 North Epcot Resorts Boulevard,Disney's BoardWalk Inn,"Orlando, FL 32830-8442",6,Lake Buena Vista,Very solid typical disney resort. We have stayed in Disney proper hotels very often and have always enjoyed them. This was our first time at The Baord walk and location was just perfect. We walked to Epcot the first day and walked to Disney studios...,"March 23, 2014","ui_bubble_rating bubble_40,ratingDate relativeDate","Solid Disney Hotel, but you may need your walking shoes because of layout of Hotel!",4.0 Star Hotel
2101 North Epcot Resorts Boulevard,Disney's BoardWalk Inn,"Orlando, FL 32830-8442",11,Lake Buena Vista,"We stayed at this hotel for our first ever Disney vacation and it was an excellent experience.
From check-in to check-out guest service was amazing, staff was very friendly and helpful with all our requests. The room (two double-beds) was nice and very clean.
The...","April 30, 2014","ui_bubble_rating bubble_50,ratingDate relativeDate",Wonderful service,4.0 Star Hotel
2101 North Epcot Resorts Boulevard,Disney's BoardWalk Inn,"Orlando, FL 32830-8442",9,Lake Buena Vista,"We entered Disney's Boardwalk Inn at 1:30 PM. The location of the room that we had requested was not given to us; but, the front desk quickly moved us to another room. However, the room didn't come available well past 3PM.
The room was lovely...","May 10, 2014","ui_bubble_rating bubble_30,ratingDate relativeDate","Some good, some bad",4.0 Star Hotel
2101 North Epcot Resorts Boulevard,Disney's BoardWalk Inn,"Orlando, FL 32830-8442",38,Lake Buena Vista,"We've stayed at several of the Disney resorts, and this was great due to it's location. The ability to walk to two theme parks made things much easier with kids. Be prepared for the football field length hallways, but enjoy the nice rooms. The lobby...","March 28, 2014","ui_bubble_rating bubble_50,ratingDate relativeDate",Location is great!,4.0 Star Hotel
2101 North Epcot Resorts Boulevard,Disney's BoardWalk Inn,"Orlando, FL 32830-8442",6,Lake Buena Vista,"I visited Disney's Boardwalk Inn regarding business but would highly recommend it for families, vacationers, etc. the amenities and service are top-notch and with close access to EPCOT and Disney's Hollywood Studios, this resort can't be beat! I stayed in a one bedroom villa which...","April 4, 2014","ui_bubble_rating bubble_40,ratingDate relativeDate",Fabulous Resort! ,4.0 Star Hotel
2101 North Epcot Resorts Boulevard,Disney's BoardWalk Inn,"Orlando, FL 32830-8442",3,Lake Buena Vista,"""Welcome Home"" - this is what we were first told as we pulled up to the gate of the hotel. Disney knows how to do it right. This was our 5th trip to Disney and our second time staying on property (we stayed at the...","April 8, 2014","ui_bubble_rating bubble_50,ratingDate relativeDate",Welcome Home,4.0 Star Hotel
2101 North Epcot Resorts Boulevard,Disney's BoardWalk Inn,"Orlando, FL 32830-8442",28,Lake Buena Vista,"We booked a two-night stay just before President's Day weekend, for Wednesday and Thursday nights. All the Disney hotels we looked at were heavily booked already, and were either sold out or had high rates. We chose the Boardwalk Inn because it had a great...","April 14, 2014","ui_bubble_rating bubble_50,ratingDate relativeDate",A lesson in (great) guest service,4.0 Star Hotel
2101 North Epcot Resorts Boulevard,Disney's BoardWalk Inn,"Orlando, FL 32830-8442",24,Lake Buena Vista,"Overall, the resort worked well for it's intended purpose. We used the Disney Magical Express to transport ourselves from the airport to the hotel. While it is stress free, it takes longer than traditional transportation because it has a couple of stops.
As mentioned the...","March 4, 2014","ui_bubble_rating bubble_30,ratingDate relativeDate","Convenient, but not Disney Quality",4.0 Star Hotel
2101 North Epcot Resorts Boulevard,Disney's BoardWalk Inn,"Orlando, FL 32830-8442",39,Lake Buena Vista,"Our family absolutely loves the Boardwalk. We feel like we are at home from the time we are welcomed ""Home"" at the entrance upon our arrival. The rooms at the Boardwalk are beautiful and exactly what one would expect of a deluxe resort. The Boardwalk...","March 1, 2014","ui_bubble_rating bubble_50,ratingDate relativeDate",Our Home Away From Home!,4.0 Star Hotel
2101 North Epcot Resorts Boulevard,Disney's BoardWalk Inn,"Orlando, FL 32830-8442",86,Lake Buena Vista,"My wife and I just returned from a 5-night stay at this property. We were fully impressed by the Disney experience in general and fully enjoyed our time at this Inn. Large room, wonderful access to the boardwalk and dining, beautiful interior and grounds, and...","January 30, 2014","ui_bubble_rating bubble_50,ratingDate relativeDate",Simply Excellent Experience!,4.0 Star Hotel
2101 North Epcot Resorts Boulevard,Disney's BoardWalk Inn,"Orlando, FL 32830-8442",20,Lake Buena Vista,You will not be sorry for paying the price to stay at this resort. Walk into the back of beautiful Epcot each morning and just be amazed! clean and a lot of things to do in the evenings as well on the boardwalk itself.,"January 30, 2014","ui_bubble_rating bubble_50,ratingDate relativeDate",stayed there for many years,4.0 Star Hotel
2101 North Epcot Resorts Boulevard,Disney's BoardWalk Inn,"Orlando, FL 32830-8442",29,Lake Buena Vista,We stayed at Disney Boardwalk the week prior to Thanksgiving and I fell in love with this resort! We have stayed at Disney Yacht Club and Disney Beach Club and Polynesian. We were used to being able to walk to Epcot staying at both Yacht...,"January 29, 2014","ui_bubble_rating bubble_50,ratingDate relativeDate",New favorite Disney resort!,4.0 Star Hotel
2101 North Epcot Resorts Boulevard,Disney's BoardWalk Inn,"Orlando, FL 32830-8442",18,Lake Buena Vista,"Decided to splurge since we don't visit Disney on a regular basis. Rooms are nice, ample size for 2 people. Would be cramped with more. Bed was comfortable, just a little on the hard size - just depends on ones personal preference.
Long walk from...","March 19, 2014","ui_bubble_rating bubble_30,ratingDate relativeDate","Okay , but overpriced",4.0 Star Hotel
2101 North Epcot Resorts Boulevard,Disney's BoardWalk Inn,"Orlando, FL 32830-8442",18,Lake Buena Vista,"We arrived at about 10:00 am and had a short wait for check in. Our room (5308) was ready upon arrival. We had done online check in and requested a high floor, with a fireworks view and Disney certainly delivered! The room was very comfortable...","March 19, 2014","ui_bubble_rating bubble_40,ratingDate relativeDate",Fabulous location for World Showcase,4.0 Star Hotel
2101 North Epcot Resorts Boulevard,Disney's BoardWalk Inn,"Orlando, FL 32830-8442",45,Lake Buena Vista,"My wife and I decided that we wanted the connivence of staying in the park since we planned on visiting Epcot and Hollywood studios. The hotel is a beautiful place, very upscale, and you can walk to Epcot in minutes,or take a boat ride there...","March 18, 2014","ui_bubble_rating bubble_40,ratingDate relativeDate","Great location,beautiful hotel,paper thin walls",4.0 Star Hotel
2101 North Epcot Resorts Boulevard,Disney's BoardWalk Inn,"Orlando, FL 32830-8442",11,Lake Buena Vista,The room size was okay for 2 adults and 2 children. The bathroom was not user friendly in the least. I had to wrench the tub faucet on and off when we used it as otherwise it dripped. The shower head if not adjusted just...,"March 17, 2014","ui_bubble_rating bubble_30,ratingDate relativeDate","Convenient, but not the quality I was anticipating.",4.0 Star Hotel
2101 North Epcot Resorts Boulevard,Disney's BoardWalk Inn,"Orlando, FL 32830-8442",20,Lake Buena Vista,"My grandchildren enjoyed the pool and slide more than Disney. It was kinda of a hike to the room. If I wanted to complain thats about all I could come up, and pool drinks are expensive. You may want to stock up on alcohol before...","March 23, 2014","ui_bubble_rating bubble_50,ratingDate relativeDate",Very nice place.,4.0 Star Hotel
2101 North Epcot Resorts Boulevard,Disney's BoardWalk Inn,"Orlando, FL 32830-8442",20,Lake Buena Vista,"I think that as a place of accommodation, this hotel comes out to be ok. It's not anything close to being a luxury hotel but the important details which usually matter to travelers like me were met --- spacious rooms, clean bathrooms with necessary amenities,...","March 22, 2014","ui_bubble_rating bubble_30,ratingDate relativeDate",Where's the Disney smile?,4.0 Star Hotel
2101 North Epcot Resorts Boulevard,Disney's BoardWalk Inn,"Orlando, FL 32830-8442",73,Lake Buena Vista,"It had been many years since I had stayed there, but I love this location and found a reasonable rate considering spring break season. I had read some negative reviews, but it's hard to imagine why. It is a large comfortable room, 2 sink bathroom,...","March 20, 2014","ui_bubble_rating bubble_40,ratingDate relativeDate","Great location, great hotel",4.0 Star Hotel
2101 North Epcot Resorts Boulevard,Disney's BoardWalk Inn,"Orlando, FL 32830-8442",51,Lake Buena Vista,"The Boardwalk is an answer for those who really appreciate and enjoy a Disney experience. You walk to EPCOT and Hollywood Studios ... or you take a quick, kind of fun, boat ride. The Boardwalk itself is a pleasant evening with the several ""acts"" that...","March 19, 2014","ui_bubble_rating bubble_50,ratingDate relativeDate",A good place to stay!,4.0 Star Hotel
2101 North Epcot Resorts Boulevard,Disney's BoardWalk Inn,"Orlando, FL 32830-8442",1248,Lake Buena Vista,"I stayed here while attending a conference at The Swan Hotel. This is a nice hotel located on the boardwalk that has a few other hotels, shops, restaurants and entertainment spots. The hotel is a ten-minute walk from EPCOT and a twenty-minute walk from Hollywood...","April 27, 2014","ui_bubble_rating bubble_40,ratingDate relativeDate",Located on the boardwalk,4.0 Star Hotel
2101 North Epcot Resorts Boulevard,Disney's BoardWalk Inn,"Orlando, FL 32830-8442",22,Lake Buena Vista,We booked a Disney World vacation for my husband's 60th birthday. We were overwhelmed from the moment we started checking in. The guest service was outstanding! We were upgraded to the Innskeepers Inn. We were personally escorted to the correct elevator and from there the...,"April 24, 2014","ui_bubble_rating bubble_50,ratingDate relativeDate",Best Vacation Ever!!!!,4.0 Star Hotel
2101 North Epcot Resorts Boulevard,Disney's BoardWalk Inn,"Orlando, FL 32830-8442",52,Lake Buena Vista,"The hotel was great, the look/style is perfect for Disney and not like every other modern hotel. The facilities are great and the staff are all friendly. We had a room with two beds for us and the kids and it was very spacious.
The...","May 9, 2014","ui_bubble_rating bubble_50,ratingDate relativeDate",Dream hotel and facilities,4.0 Star Hotel
2101 North Epcot Resorts Boulevard,Disney's BoardWalk Inn,"Orlando, FL 32830-8442",10,Lake Buena Vista,"We were upgraded to a beautiful Cottage suite. Private entrance, club level, lovely suite with king bed and a huge tub! The Innkeepers at the club level were extremely helpful, lovely lounge and food and drinks!","May 5, 2014","ui_bubble_rating bubble_50,ratingDate relativeDate",Amazing experience!,4.0 Star Hotel
2101 North Epcot Resorts Boulevard,Disney's BoardWalk Inn,"Orlando, FL 32830-8442",3,Lake Buena Vista,"We arrived 9am and the room was ready at exactly 3pm. I personally liked the Boardwalk better then the Beach and Yacht because it did not seem as spread out to get to the rooms, also there seemed to be more nightly entertainment. We stayed...","May 4, 2014","ui_bubble_rating bubble_50,ratingDate relativeDate",Very Entertaining Resort,4.0 Star Hotel
2101 North Epcot Resorts Boulevard,Disney's BoardWalk Inn,"Orlando, FL 32830-8442",10,Lake Buena Vista,"This is easily one of my favorite Disney resorts. It's more pricey than many of the others but if you're looking to spend some time just enjoying your resort, this is a great option. The theming of it is perfect and the boardwalk itself is...","May 1, 2014","ui_bubble_rating bubble_50,ratingDate relativeDate",Beautiful,4.0 Star Hotel
2101 North Epcot Resorts Boulevard,Disney's BoardWalk Inn,"Orlando, FL 32830-8442",121,Lake Buena Vista,"This hotel is in a very good location, being directly on the boardwalk just outside a waterway that brings you to Epcot. Dixieland music is piped in through the sound system , giving an uplifting feeling. I was very disappointed that this hotel had no...","March 28, 2014","ui_bubble_rating bubble_30,ratingDate relativeDate",no restaurant!!!,4.0 Star Hotel
2101 North Epcot Resorts Boulevard,Disney's BoardWalk Inn,"Orlando, FL 32830-8442",16,Lake Buena Vista,"We were here for the annual conference of the National Association of Independent Schools. Coming to Walt Disney World was a huge plus for us but at the same time, I never realized how distracting it would be to come to Disney for work! Anyway,...","March 26, 2014","ui_bubble_rating bubble_50,ratingDate relativeDate",Huge Room – Great Service,4.0 Star Hotel
2101 North Epcot Resorts Boulevard,Disney's BoardWalk Inn,"Orlando, FL 32830-8442",13,Lake Buena Vista,"The rooms were ok, but slight dated. Also, as I was there traveling on business, I was disappointed in the wireless and amenities for a business traveler, especially since Disney put us up there. We were also not impressed with the restaurant options. We ended...","March 25, 2014","ui_bubble_rating bubble_30,ratingDate relativeDate",OK - but not worth the money,4.0 Star Hotel
2101 North Epcot Resorts Boulevard,Disney's BoardWalk Inn,"Orlando, FL 32830-8442",46,Lake Buena Vista,"The very best thing about this hotel is the location! It is within walking distance to Epcot and Hollywood Studios. It is just so great to have dinner or drinks at Epcot and stroll back to the hotel instead of getting on a bus.
The...","March 24, 2014","ui_bubble_rating bubble_50,ratingDate relativeDate",Stay here for the location!,4.0 Star Hotel
2101 North Epcot Resorts Boulevard,Disney's BoardWalk Inn,"Orlando, FL 32830-8442",2,Lake Buena Vista,This was one of the best stays that I've had in Orlando in the last 5 months. We checked in early on a sunday since we took the red eye and they allowed us to ck in. The room was nice with a nice view...,"April 3, 2014","ui_bubble_rating bubble_50,ratingDate relativeDate",This was a Great Hotel,4.0 Star Hotel
2101 North Epcot Resorts Boulevard,Disney's BoardWalk Inn,"Orlando, FL 32830-8442",580,Lake Buena Vista,"A favorite hotel, particularly with a Boardwalk view. Modern, with nice rooms in an excellent location.
Walkable to Epcot and Hollywood Studios, the Boardwalk offers convenience, as well.
Restaurants are predominantly
on the Boardwalk, a short distance from the hotel.","April 3, 2014","ui_bubble_rating bubble_50,ratingDate relativeDate",Wonderful Hotel with Outstanding Views Available,4.0 Star Hotel
2101 North Epcot Resorts Boulevard,Disney's BoardWalk Inn,"Orlando, FL 32830-8442",26,Lake Buena Vista,"My husband, myself and two daughters just arrived home this evening from Disney. We LOVED the boardwalk hotel. Upon arrival from the Magical Express, (which was also efficient and fantastic) we were greeted with a friendly staff. No line for check in it was painless....","April 2, 2014","ui_bubble_rating bubble_50,ratingDate relativeDate","Love, love, loved",4.0 Star Hotel
2101 North Epcot Resorts Boulevard,Disney's BoardWalk Inn,"Orlando, FL 32830-8442",11,Lake Buena Vista,I stayed at the this hotel for a few days for business this past week. I will first caution anyone- put on your walking shoes. My room was a very long walk from the elevators. The room was clean but a bit dated. The biggest...,"March 29, 2014","ui_bubble_rating bubble_30,ratingDate relativeDate",A bit disappointed overall...,4.0 Star Hotel
2101 North Epcot Resorts Boulevard,Disney's BoardWalk Inn,"Orlando, FL 32830-8442",18,Lake Buena Vista,"After staying in several different Disney hotels in Orlando we decided to stay here. By far it was one of the best, the service, the cleanliness - everything was perfect. So pleased we chose to stay here as it made our holiday an even better...","April 7, 2014","ui_bubble_rating bubble_50,ratingDate relativeDate",Excellent as always,4.0 Star Hotel
2101 North Epcot Resorts Boulevard,Disney's BoardWalk Inn,"Orlando, FL 32830-8442",4,Lake Buena Vista,"I stayed at the Boardwalk before moving onto the Hard Rock @ Universal.
The hotel is AMAZING! The grounds are beautiful and even upon entering the hotel you can tell you are in a very good standard of 5*.
The rooms were very spacious and...","April 7, 2014","ui_bubble_rating bubble_50,ratingDate relativeDate",2nd Time To Disney - AMAZING,4.0 Star Hotel
2101 North Epcot Resorts Boulevard,Disney's BoardWalk Inn,"Orlando, FL 32830-8442",73,Lake Buena Vista,Having family in Orlando Our family visits WDW a few times a year. We have visited many of the WDW properties. I love the location of this property as it is within walking distance to both EPCOT and Hollywood Studios. If you arrive early ask...,"April 6, 2014","ui_bubble_rating bubble_40,ratingDate relativeDate",Boardwalk Inn,4.0 Star Hotel
2101 North Epcot Resorts Boulevard,Disney's BoardWalk Inn,"Orlando, FL 32830-8442",14,Lake Buena Vista,Our family recently spent eight nights at the BW and really enjoyed it. The hotel is very nice compared to other WDW properties. We have stayed at various intermediate and deluxe hotels on the property and this one was comparable to the other deluxe resorts....,"April 6, 2014","ui_bubble_rating bubble_40,ratingDate relativeDate",Very Enjoyable Visit,4.0 Star Hotel
2101 North Epcot Resorts Boulevard,Disney's BoardWalk Inn,"Orlando, FL 32830-8442",19,Lake Buena Vista,"Lovely hotel. We never met Pat, our housekeeper until the last day of our trip but she seemed very aware we liked to sleep in and needed double the towels for our teenagers. We spent extra for the Club Level. It was a small room...","April 12, 2014","ui_bubble_rating bubble_50,ratingDate relativeDate",Best vacation ever...,4.0 Star Hotel
2101 North Epcot Resorts Boulevard,Disney's BoardWalk Inn,"Orlando, FL 32830-8442",14,Lake Buena Vista,"Loved the location, the conference facilities were phenomenal and comfortable, the rooms were extremely comfortable, clean and well maintained. Staff was as expected, as this is Disney and they were very responsive and helpful.","April 12, 2014","ui_bubble_rating bubble_50,ratingDate relativeDate",conference and stay,4.0 Star Hotel
2101 North Epcot Resorts Boulevard,Disney's BoardWalk Inn,"Orlando, FL 32830-8442",32,Lake Buena Vista,"I have stayed at a lot of Disney hotels and this was my first time staying at the Boardwalk Inn. I also must add it that it is now one of my favorite Disney hotels to stay at. Although, for what you are getting I...","April 9, 2014","ui_bubble_rating bubble_40,ratingDate relativeDate","Wonderful hotel, slightly overpriced",4.0 Star Hotel
2101 North Epcot Resorts Boulevard,Disney's BoardWalk Inn,"Orlando, FL 32830-8442",134,Lake Buena Vista,We had the privilege of staying Club Level at Boardwalk Inn the last week of January 2014. Loved this hotel! The ambiance is great; I loved the 40s style music that played on the grounds and in the halls. The Club Level staff were attentive...,"April 9, 2014","ui_bubble_rating bubble_50,ratingDate relativeDate",Boardwalk Inn Club Level with Boardwalk View=Perfection!,4.0 Star Hotel
2101 North Epcot Resorts Boulevard,Disney's BoardWalk Inn,"Orlando, FL 32830-8442",6,Lake Buena Vista,"Although it was a bit of hike to get to our room from the lobby, the villa we stayed at was wonderful! Great size one bedroom with a comfy pullout for the kids. The kitchenette was a great size for breakfast and lunch and loved...","April 21, 2014","ui_bubble_rating bubble_40,ratingDate relativeDate",Great Villa!,4.0 Star Hotel
2101 North Epcot Resorts Boulevard,Disney's BoardWalk Inn,"Orlando, FL 32830-8442",20,Lake Buena Vista,We are DVC members and have stayed here almost every year for the last 8 years. Having a boardwalk view makes this place the best to stay at Disneyworld. we leave our balcony door cracked open a couple of inches. Waking to the boardwalk music...,"April 19, 2014","ui_bubble_rating bubble_50,ratingDate relativeDate",Excellent as usual,4.0 Star Hotel
2101 North Epcot Resorts Boulevard,Disney's BoardWalk Inn,"Orlando, FL 32830-8442",4,Lake Buena Vista,"So many things I loved about this hotel!
We researched many hotels for our 8 day trip to WDW and we picked the Boardwalk for its location (easy short boat ride to 2 of the 4 parks - the less time on a bus the...","May 15, 2014","ui_bubble_rating bubble_50,ratingDate relativeDate",Great place to call 'home' after a day at the busy parks,4.0 Star Hotel
2101 North Epcot Resorts Boulevard,Disney's BoardWalk Inn,"Orlando, FL 32830-8442",6,Lake Buena Vista,"I am a Disney nut, but have never stayed on property. I am so glad we did this time! It was only my boyfriend and I, we really adored the resort and the impecable service! Of course, done in Disney's way, you feel immersed in...","May 20, 2014","ui_bubble_rating bubble_50,ratingDate relativeDate","So fun, So beautiful, so close!!",4.0 Star Hotel
2101 North Epcot Resorts Boulevard,Disney's BoardWalk Inn,"Orlando, FL 32830-8442",54,Lake Buena Vista,"Spent six wonderful nights at Boardwalk in late May with my family, and we absolutely loved it! Our room was in a great location on the ground floor. We were very close to the lobby and the boardwalk, and our room overlooked the larger pool....","June 1, 2014","ui_bubble_rating bubble_40,ratingDate relativeDate","Wonderful, with only one blemish",4.0 Star Hotel
2101 North Epcot Resorts Boulevard,Disney's BoardWalk Inn,"Orlando, FL 32830-8442",4,Lake Buena Vista,"We stayed at the boardwalk inn June 2014. We booked 2 rooms as we had grandparents with us. The staff was friendly and provided good service. However, my parents room the toilet clogged the first night and housekeeping fixed it then the second night the...","June 14, 2014","ui_bubble_rating bubble_30,ratingDate relativeDate",Bathroom problems,4.0 Star Hotel
